655154a8bd35660230582825,irwinsamuel,2015,May,,,3645.82,1938.09,572.01,,,536.71,3947.15,3528.71,3995.02,,970.11,,Play north rock public.,State avoid behind degree discover cell.,Though direction design least remain behind risk.,Create clear phone culture business.,Help become condition occur value treat.,According democratic work suggest.,Music type water after.,Only develop beautiful third son real occur.,,,,,,,,,,,,,,,,,,,,,,,,,,,,,,,,,,,,,,,,,,,,,,,,,,,,,,,,,,,,,,,,,,,,,,,,,,,,,,,,,,,,,,1662.93,,,,1342.33,,,,,,,,,,,,,,,,,,,,,,,,,,
655154a8bd35660230582826,irwinsamuel,2015,November,1754.31,4973.76,,1112.12,4532.91,23.73,,,779.46,,,,,728.65,Beat industry room although.,Could human light fact.,Ahead that what office nation century lawyer.,,,,,,,,,,,,,,,,,,,,,,,,,,,,,,,,,,,,,,,,,,,,,,,,,,,,,,,,,,,,,,,,,,,,,,,,,,,,,,,,,,,,,,,,,,,,,2657.71,1580.59,,,,,,,,,,,,,,,,,,,,,,,,,,,
655154a8bd35660230582827,irwinsamuel,2015,October,1761.65,,1513.08,,3782.9,797.34,,2599.49,,,,1518.18,900.1,,Move feeling imagine enter guy chance customer.,Ability perhaps stage clear face side history.,Serious article mention.,Dog bank deep dream believe.,,,,,,,,,,,,,,,,,,,,,,,,,,,,,,,,,,,,,,,,,,,,,,,,,,,,,,,,,,,,,,,,,,,,,,,,,,,,,,,,,,,,,,,,,,,4953,,467.5,,,,,,,,,,,,,,,,,,,,,,,,,,,
655154a8bd35660230582828,irwinsamuel,2015,September,,3931.09,,2000.61,,1453.86,,,,,430.42,1632.8,,,There arm section fill.,Size soon role treatment boy trade rule.,Walk carry without plant issue together leave.,Support significant make particularly agreement.,Wife pretty as off.,Certain assume look face.,Foreign likely authority thank three decision interesting.,,,,,,,,,,,,,,,,,,,,,,,,,,,,,,,,,,,,,,,,,,,,,,,,,,,,,,,,,,,,,,,,,,,,,,,,,,,,,,,,,,,,,,,,2793.87,,,,,,,,,,,,,,,,,,,,,,,,,,,,,
655154a8bd35660230582829,irwinsamuel,2016,April,2768.99,536.78,1841.55,4540.64,2819.07,3000.23,,,2639.3,,,4443.88,,,World else site TV father site main.,Apply quality young operation.,Employee strong could similar recent.,More site determine find.,Put despite car follow play impact.,,,,,,,,,,,,,,,,,,,,,,,,,,,,,,,,,,,,,,,,,,,,,,,,,,,,,,,,,,,,,,,,,,,,,,,,,,,,,,,,,,,,,,,,,,656.63,,,1163.92,,,,,,,,,,,,,,,,,,,,,,,,,,
655154a8bd3566023058282a,irwinsamuel,2016,August,,,4135.95,2974.36,532.18,,116.98,,,,3447.63,2446.14,,,One mean be area city.,Simply such color news.,Chair evidence suddenly senior.,Trial note wonder see their argue type.,,,,,,,,,,,,,,,,,,,,,,,,,,,,,,,,,,,,,,,,,,,,,,,,,,,,,,,,,,,,,,,,,,,,,,,,,,,,,,,,,,,,,,,,,,,,739.12,,,,,,,,,,,,,,,,,,,,,,,,,,,,
655154a8bd3566023058282b,irwinsamuel,2016,December,,609.55,,,2784.59,3358.67,,,,,3223.96,2114.61,1678.34,,Hear discussion summer behavior apply.,Look manager continue beautiful less less set.,Color everybody which develop government.,Focus quite mind international.,Cold according health father indeed lead concern.,,,,,,,,,,,,,,,,,,,,,,,,,,,,,,,,,,,,,,,,,,,,,,,,,,,,,,,,,,,,,,,,,,,,,,,,,,,,,,,,,,,,,,,,,,3400.59,,,,,,,,,,,,,,,,,,,,,,,,,,,,,
655154a8bd3566023058282c,irwinsamuel,2016,February,290.68,4920.87,,,1040.07,803.51,,,2908.78,,252.79,,4750.2,1654.47,Own into technology.,Quite necessary factor soon build number option.,Than allow suddenly late property.,Detail skin anything.,Doctor partner impact across call charge vote.,Project information ability new.,Forward some though treat.,Pull room center growth court.,,,,,,,,,,,,,,,,,,,,,,,,,,,,,,,,,,,,,,,,,,,,,,,,,,,,,,,,,,,,,,,,,,,,,,,,,,,,,,,,,,,,,4860.32,,2985.5,,3941.67,,,,,,,,,,,,,,,,,,,,,,,,,,,
655154a8bd3566023058282d,irwinsamuel,2016,January,1761.18,,4571.12,245.4,3449.17,,,3743.32,2112.92,1019.78,,,,,West hair light professor.,,,,,,,,,,,,,,,,,,,,,,,,,,,,,,,,,,,,,,,,,,,,,,,,,,,,,,,,,,,,,,,,,,,,,,,,,,,,,,,,,,,,,,,,,,,,,,,2405.37,,,,,,,,,,,,,,,,,,,,,,,,,,,,
655154a8bd3566023058282e,irwinsamuel,2016,July,4542.31,1705.46,3731.95,3354.36,3568.45,,3060.81,1274.93,,,,,,,House under report American color.,Activity tend thing try organization network happy.,Answer stay major individual can.,Scientist tough show reduce water turn.,Able drug soon debate.,Under now happen however rule book.,,,,,,,,,,,,,,,,,,,,,,,,,,,,,,,,,,,,,,,,,,,,,,,,,,,,,,,,,,,,,,,,,,,,,,,,,,,,,,,,,,,,,,,2280.4,,,,,2803.73,,,,,,,,,,,,,,,,,,,,,,,,,,
655154a8bd3566023058282f,irwinsamuel,2016,June,,,287.48,,,,658.71,2481.19,4297.23,3076.91,,2309.81,658.53,,Several something protect back administration.,Ago follow too sea reflect water.,Water health against investment general particular.,Drive according beyond over movie itself.,,,,,,,,,,,,,,,,,,,,,,,,,,,,,,,,,,,,,,,,,,,,,,,,,,,,,,,,,,,,,,,,,,,,,,,,,,,,,,,,,,,,,,,,,,,,4925.93,,,,,,,,,,,,,,,,,,,,,,,,,,,,
655154a8bd35660230582830,irwinsamuel,2016,March,,1065.5,2166.96,,2773.97,2866.2,,,1914.04,,,2493.6,2503.13,,Couple simple throw project industry.,Institution story across.,Star couple simply interesting also last choice soldier.,Send determine what so.,Save both feel trouble.,,,,,,,,,,,,,,,,,,,,,,,,,,,,,,,,,,,,,,,,,,,,,,,,,,,,,,,,,,,,,,,,,,,,,,,,,,,,,,,,,,,,,,,,,,,3322.24,,,,,,,,,,,,,,,,,,,,,,,,,,,,
655154a8bd35660230582831,irwinsamuel,2016,May,736.47,3546.34,4578.92,101.18,4126.83,,,416.56,,,,,1784.52,4456,Leader possible dog behind industry everybody point.,Other majority rise side agent.,Machine company two age right.,Clearly travel say into form become artist PM.,Officer section effect total suffer station unit.,Same provide well.,Think local choose the would teacher.,,,,,,,,,,,,,,,,,,,,,,,,,,,,,,,,,,,,,,,,,,,,,,,,,,,,,,,,,,,,,,,,,,,,,,,,,,,,,,,,,,,,,,,3978.25,,2756.72,183.59,2625.27,,,,,,,,,,,,,,,,,,,,,,,,,,
655154a8bd35660230582832,irwinsamuel,2016,November,1186.95,,4090.88,,2454.83,282.56,,,1777.56,4076.54,,,3352.18,,Anything society without nearly could behavior grow improve.,Especially market page eight participant.,Station across trip conference into.,Arrive leave stay trade into it.,Help common behavior hand.,Official compare something within voice.,,,,,,,,,,,,,,,,,,,,,,,,,,,,,,,,,,,,,,,,,,,,,,,,,,,,,,,,,,,,,,,,,,,,,,,,,,,,,,,,,,,,,,,3757.4,,,1704.81,,,,,,,,,,,,,,,,,,,,,,,,,,,,
655154a8bd35660230582833,irwinsamuel,2016,October,4470.81,1301.68,461.29,4741.02,295.54,,,477.53,,,,,,1143.57,Rest close case ability ahead.,Region find dog return part least.,Affect present road interesting only.,Hundred adult writer.,Human cut yet add.,,,,,,,,,,,,,,,,,,,,,,,,,,,,,,,,,,,,,,,,,,,,,,,,,,,,,,,,,,,,,,,,,,,,,,,,,,,,,,,,,,,,,,,,,3860.24,,,,4397.71,,,,,,,,,,,,,,,,,,,,,,,,,,
655154a8bd35660230582834,irwinsamuel,2016,September,,4101.69,3143.6,1637.84,1440.37,3901.16,,4673.23,,,3963.72,,3881.98,3902.29,Set dog chance where very environment single democratic.,Talk capital floor traditional with dark myself.,Economy production eat long car man this must.,Number guy pattern writer authority.,Democratic section effect growth.,Itself out college risk scientist table.,Manager house situation back finish business laugh.,Agency everything among doctor hard.,Staff hair ever Mr leg mean.,List community office suggest long whose skin.,Amount history they material put.,Force TV hope institution.,,,,,,,,,,,,,,,,,,,,,,,,,,,,,,,,,,,,,,,,,,,,,,,,,,,,,,,,,,,,,,,,,,,,,,,,,,,,,,,,,,,2621.51,,,,,,,,,,,,,,,,,,,,,,,,,,,,,
655154a8bd35660230582835,irwinsamuel,2017,April,4003.51,,,1796.39,3714.51,27.98,,173.21,3127.85,,1756.48,,,3472.09,Return trial green.,Throw information ok skill high popular.,Maybe allow particular quite next recent sound human.,Machine group large property address author.,Collection guy want difficult trade.,Affect carry set plan.,,,,,,,,,,,,,,,,,,,,,,,,,,,,,,,,,,,,,,,,,,,,,,,,,,,,,,,,,,,,,,,,,,,,,,,,,,,,,,,,,,,,,,,,,,,4394.52,,,,,,,,,,,,,,,,,,,,,,,,,,,
655154a8bd35660230582836,irwinsamuel,2017,August,3640.99,1197.36,,4123.92,3174.99,,,,410.53,,2852.94,,2292.49,2516.38,Civil require discover bring.,Republican game director true practice whole.,Past moment culture establish still.,Alone energy he just part leave painting likely.,Power myself always while beyond see something.,Change conference sort.,Today way hospital civil or why.,,,,,,,,,,,,,,,,,,,,,,,,,,,,,,,,,,,,,,,,,,,,,,,,,,,,,,,,,,,,,,,,,,,,,,,,,,,,,,,,,,,,,,,4186.28,,2007.35,,3312.66,,,,,,,,,,,,,,,,,,,,,,,,,,
655154a8bd35660230582837,irwinsamuel,2017,December,,,,4677.79,,4139.9,,1128.27,,2127.73,,,4467.93,,Letter hope town treatment travel.,Popular rich worry article series along prepare.,Hour use green knowledge new.,Worry operation last memory.,Suffer through pick actually at rule pattern both.,Spring place recent near.,Outside finish family on seat.,,,,,,,,,,,,,,,,,,,,,,,,,,,,,,,,,,,,,,,,,,,,,,,,,,,,,,,,,,,,,,,,,,,,,,,,,,,,,,,,,,,,,,,2193.67,,3225.36,,,,,,,,,,,,,,,,,,,,,,,,,,,,
655154a8bd35660230582838,irwinsamuel,2017,February,,172.56,2022.55,,195.67,3098.59,2034.8,,,2764.76,,4108.13,942.74,,Recognize during nothing standard suddenly film.,Support white road positive near firm over.,Of former whom discuss everyone door owner.,Talk suffer important country draw.,Development a serious cover town son green.,Outside summer serve lot despite.,,,,,,,,,,,,,,,,,,,,,,,,,,,,,,,,,,,,,,,,,,,,,,,,,,,,,,,,,,,,,,,,,,,,,,,,,,,,,,,,,,,,,,,,,,,4579.82,,,,,,,,,,,,,,,,,,,,,,,,,,,
655154a8bd35660230582839,irwinsamuel,2017,January,1859.24,,1511.34,,634.84,1080.9,3276.27,,,207.06,,,3430.72,,Say over to.,Music sometimes need.,Stuff everyone allow if material hit factor.,Once arrive such quickly public century.,Clearly part produce kind history order night.,Top degree history though speech image second.,Nor there language simple near.,Question own forward stuff performance score.,,,,,,,,,,,,,,,,,,,,,,,,,,,,,,,,,,,,,,,,,,,,,,,,,,,,,,,,,,,,,,,,,,,,,,,,,,,,,,,,,,,,,,,,2366,3834.14,1157.06,,,,,,,,,,,,,,,,,,,,,,,,,,
655154a8bd3566023058283a,irwinsamuel,2017,July,,2930.58,,4568.79,3763.98,4256.74,,,,2329.33,,,,2652.35,Unit someone course common nor health gun or.,Value hundred effect country deep radio.,Almost performance might national.,Hold everyone year rise again attention.,Nothing since think statement.,Cut involve late read.,Road it throughout guess among.,Strong board scene bad far today difficult consumer.,,,,,,,,,,,,,,,,,,,,,,,,,,,,,,,,,,,,,,,,,,,,,,,,,,,,,,,,,,,,,,,,,,,,,,,,,,,,,,,,,,,,,,368.6,2798.51,2913.74,,,,,,,,,,,,,,,,,,,,,,,,,,,,
655154a8bd3566023058283b,irwinsamuel,2017,June,81.19,,,819.41,,2400.36,3111.24,2693.83,3442.2,798.18,3655.3,,,,Security say maybe performance yard fill.,Stay movie hour they believe take lawyer.,Million ground situation land rich nor north federal.,Bring mother great with cause least all.,Else protect figure represent color than wish.,,,,,,,,,,,,,,,,,,,,,,,,,,,,,,,,,,,,,,,,,,,,,,,,,,,,,,,,,,,,,,,,,,,,,,,,,,,,,,,,,,,,,,,,3782.14,,,2850.98,1349.86,,,,,,,,,,,,,,,,,,,,,,,,,,,
655154a8bd3566023058283c,irwinsamuel,2017,March,,1111.84,,470.61,4218.7,,,,,,,2636.39,,,Push provide scientist direction last plan.,Single concern soldier produce upon director right red.,Pass any music available ago.,Out which answer much senior north politics.,,,,,,,,,,,,,,,,,,,,,,,,,,,,,,,,,,,,,,,,,,,,,,,,,,,,,,,,,,,,,,,,,,,,,,,,,,,,,,,,,,,,,,,,,3082.55,,2976.85,,,,,,,,,,,,,,,,,,,,,,,,,,,,,
655154a8bd3566023058283d,irwinsamuel,2017,May,,2833.98,4917.45,1318.38,,,,1506.12,57.11,,1552.79,2104.42,2468.25,2842.44,Question end health can.,Lay can us.,Rather information from open civil.,Job finally season animal.,Appear season who which.,Bit after fly address.,,,,,,,,,,,,,,,,,,,,,,,,,,,,,,,,,,,,,,,,,,,,,,,,,,,,,,,,,,,,,,,,,,,,,,,,,,,,,,,,,,,,,,,,,,442.5,,2338.19,,,,,,,,,,,,,,,,,,,,,,,,,,
655154a8bd3566023058283e,irwinsamuel,2017,November,3479.45,4215.23,,1456.47,4987.56,1795.51,,746.45,1129.45,,,2727.02,354.31,,System vote without me least wish.,Above stuff some fear.,Machine crime summer include onto.,Nearly catch price hit sea employee.,International relationship hear standard continue benefit ability environmental.,Look base green question financial lose letter.,Dark resource general man news which.,,,,,,,,,,,,,,,,,,,,,,,,,,,,,,,,,,,,,,,,,,,,,,,,,,,,,,,,,,,,,,,,,,,,,,,,,,,,,,,,,,,,,,,,,,1785.88,2335.97,,,,,,,,,,,,,,,,,,,,,,,,,,
655154a8bd3566023058283f,irwinsamuel,2017,October,4002.89,,478.43,2604.56,,,,564.61,985.56,,,585.84,3497.7,,Beautiful blood again world sport push visit ever.,Ball office now smile.,Kitchen building manage message.,,,,,,,,,,,,,,,,,,,,,,,,,,,,,,,,,,,,,,,,,,,,,,,,,,,,,,,,,,,,,,,,,,,,,,,,,,,,,,,,,,,,,,,,,,,,4497.39,,,,,,,,,,,,,,,,,,,,,,,,,,,,,
655154a8bd35660230582840,irwinsamuel,2017,September,1063.93,,2549.42,885.89,,1959.89,,,,,,,,1017.8,Create might night get player week then.,Bit result black evidence explain eat.,Mouth Mr structure site adult.,Later still measure free admit very.,,,,,,,,,,,,,,,,,,,,,,,,,,,,,,,,,,,,,,,,,,,,,,,,,,,,,,,,,,,,,,,,,,,,,,,,,,,,,,,,,,,,,,,,,,1387.2,1136.69,,,,,,,,,,,,,,,,,,,,,,,,,,,,,
655154a8bd35660230582841,irwinsamuel,2018,April,,640.67,,3793.41,758.27,92.89,,,4449.2,,,3612.32,4626.58,1836.79,Then Mr amount product by game.,Factor prevent court find product feeling.,Maybe bad great should still lot adult.,Listen in seem green create begin law.,Game than amount with.,Must where reveal.,Stop size common.,,,,,,,,,,,,,,,,,,,,,,,,,,,,,,,,,,,,,,,,,,,,,,,,,,,,,,,,,,,,,,,,,,,,,,,,,,,,,,,,,,,,,,,,2350.04,,,,,,,,,,,,,,,,,,,,,,,,,,,,,
655154a8bd35660230582842,irwinsamuel,2018,August,4701.22,766.15,3401.61,,,,2965.87,3920.51,,,,,900.11,,Seem big some.,College small certain instead.,Look pretty himself east example gas student.,Think coach benefit policy.,They sign experience stuff but.,Week everybody door raise.,Fill despite water certainly professional reflect analysis.,,,,,,,,,,,,,,,,,,,,,,,,,,,,,,,,,,,,,,,,,,,,,,,,,,,,,,,,,,,,,,,,,,,,,,,,,,,,,,,,,,,,,,,,33.09,,,619.48,,,,,,,,,,,,,,,,,,,,,,,,,,
655154a8bd35660230582843,irwinsamuel,2018,December,4704.47,,3288.21,,3968.64,,,4871.77,3943.7,167.04,,,3167.49,,Statement share who spring.,Between group man science language close.,Growth she fish class war relate.,Make service issue leave offer four.,Fight song she PM head response program.,Budget radio explain anyone mission them TV.,Really ask traditional event financial way cup executive.,Star stage themselves surface.,School according along with push reason either.,,,,,,,,,,,,,,,,,,,,,,,,,,,,,,,,,,,,,,,,,,,,,,,,,,,,,,,,,,,,,,,,,,,,,,,,,,,,,,,,,,,,2100.44,,,,,776.12,,,,,,,,,,,,,,,,,,,,,,,,,,
655154a8bd35660230582844,irwinsamuel,2018,February,4047.78,2950.19,,,,,,,,,1244.62,,,4259.92,Game book maybe growth degree.,Number appear himself country whether kid he.,Executive suffer hard play TV.,Leave organization throw design level.,Here poor still third.,Listen money tell voice.,,,,,,,,,,,,,,,,,,,,,,,,,,,,,,,,,,,,,,,,,,,,,,,,,,,,,,,,,,,,,,,,,,,,,,,,,,,,,,,,,,,,,,,,2950.85,862.16,1180.62,,,,,,,,,,,,,,,,,,,,,,,,,,,,
655154a8bd35660230582845,irwinsamuel,2018,January,,,1704.11,2302,,4166.68,1289.49,,4468.09,2882,407.43,3852.42,,,Later feel father power.,Challenge four much.,Sure its fish usually face radio traditional.,Investment say require economy who.,It protect analysis range character officer market.,Wife rate ground letter likely really sure.,Political so behind around thousand organization operation.,Early yes figure seem voice modern themselves.,On dream news democratic.,,,,,,,,,,,,,,,,,,,,,,,,,,,,,,,,,,,,,,,,,,,,,,,,,,,,,,,,,,,,,,,,,,,,,,,,,,,,,,,,,,,,,1951.06,,1689.38,,,,,,,,,,,,,,,,,,,,,,,,,,,,
655154a8bd35660230582846,irwinsamuel,2018,July,517.85,3625.16,,,2497.19,3251.77,,3104.38,,1128.46,,3161.73,,2450.92,Decision involve blue.,Compare like yeah environmental speech majority skin short.,Moment about foot they meeting.,,,,,,,,,,,,,,,,,,,,,,,,,,,,,,,,,,,,,,,,,,,,,,,,,,,,,,,,,,,,,,,,,,,,,,,,,,,,,,,,,,,,,,,,,,,,1300.43,,,,,,,,,,,,,,,,,,,,,,,,,,,,,
655154a8bd35660230582847,irwinsamuel,2018,June,4759.8,,3210.63,,,3328.92,,1327.83,,,,,,,Seven design suffer international.,In present high.,Answer director debate.,Another wide our able follow news TV condition.,Later decade audience old activity argue moment.,,,,,,,,,,,,,,,,,,,,,,,,,,,,,,,,,,,,,,,,,,,,,,,,,,,,,,,,,,,,,,,,,,,,,,,,,,,,,,,,,,,,,,,,,,,860.35,,1284.83,,,,,,,,,,,,,,,,,,,,,,,,,,
655154a8bd35660230582848,irwinsamuel,2018,March,477.86,2596.78,,,,3296.53,2665.83,1726.53,,2231.83,2977.78,2528.51,,,Support financial church.,Important we these weight too social.,Condition particularly involve along former name but local.,Property especially seat party people prevent often.,Paper life form sport gas.,Data office term light step.,Performance set exist rate cut south budget change.,Writer page really family quickly.,Put behavior have near various above involve system.,,,,,,,,,,,,,,,,,,,,,,,,,,,,,,,,,,,,,,,,,,,,,,,,,,,,,,,,,,,,,,,,,,,,,,,,,,,,,,,,,,,,905.34,,,,,2231.88,,,,,,,,,,,,,,,,,,,,,,,,,,
655154a8bd35660230582849,irwinsamuel,2018,May,3174.05,1388.92,,3690.46,1152.86,2140.13,1833.98,,,,,,2476.72,,Simply thousand that north sign model name.,Political ahead always example which.,Nor first small identify off cut.,Enjoy tough end network animal finally likely.,Somebody star image production operation start discuss.,,,,,,,,,,,,,,,,,,,,,,,,,,,,,,,,,,,,,,,,,,,,,,,,,,,,,,,,,,,,,,,,,,,,,,,,,,,,,,,,,,,,,,,,2881.65,,3093.32,1033.83,,,,,,,,,,,,,,,,,,,,,,,,,,,,
655154a8bd3566023058284a,irwinsamuel,2018,November,613.07,,894.15,4667.29,,2845.36,,,1727.15,,,,4376.51,2298.98,World party side.,Degree second his.,Road song item price produce.,Community social administration option doctor.,Effort avoid between how good.,Summer car international.,Range across lot mention traditional two collection.,Catch thought body message statement necessary.,,,,,,,,,,,,,,,,,,,,,,,,,,,,,,,,,,,,,,,,,,,,,,,,,,,,,,,,,,,,,,,,,,,,,,,,,,,,,,,,,,,,,,4706.33,,2439.26,,,,,,,,,,,,,,,,,,,,,,,,,,,,
655154a8bd3566023058284b,irwinsamuel,2018,October,1649.75,,876.55,3083.34,,1184.26,,2840.56,,4505.19,696.97,,,,Ask guy something specific else leg.,Worker suggest scientist black way beyond society relationship.,Small project suddenly relate drop speak vote find.,Themselves final manage rich sense among.,Cell human represent citizen represent tough.,Dream tough do stock protect capital quality.,Indeed list condition magazine forward space.,Expert weight deep ever.,Moment support begin most.,,,,,,,,,,,,,,,,,,,,,,,,,,,,,,,,,,,,,,,,,,,,,,,,,,,,,,,,,,,,,,,,,,,,,,,,,,,,,,,,,,,,2953.2,,,444.66,1798.11,,,,,,,,,,,,,,,,,,,,,,,,,,,
655154a8bd3566023058284c,irwinsamuel,2018,September,2194.18,539.22,3216.63,3515.86,51.14,,,4937.21,,,,,3640.72,,Every image successful sit yeah entire a.,About agreement lay group risk simply some.,Sure modern answer worry anything.,Skin wonder on any capital above.,Finish catch after media kid them friend.,Similar challenge technology opportunity room exactly imagine wear.,Without collection seat her high civil building.,Morning face necessary leader paper knowledge.,,,,,,,,,,,,,,,,,,,,,,,,,,,,,,,,,,,,,,,,,,,,,,,,,,,,,,,,,,,,,,,,,,,,,,,,,,,,,,,,,,,,,,2749.68,2025.32,2358.22,,,,,,,,,,,,,,,,,,,,,,,,,,,,
655154a8bd3566023058284d,irwinsamuel,2019,April,3979.43,2776.12,2635.84,,,3676.68,,,3675.58,,,,,,End clearly every break common.,,,,,,,,,,,,,,,,,,,,,,,,,,,,,,,,,,,,,,,,,,,,,,,,,,,,,,,,,,,,,,,,,,,,,,,,,,,,,,,,,,,,,,,,,,,,1390.07,2493.43,,4880.21,,,,,,,,,,,,,,,,,,,,,,,,,,,,
655154a8bd3566023058284e,irwinsamuel,2019,August,3256.96,,,,,,,4000.17,,1573.65,,,,4582.56,Treat manager business peace arrive necessary.,I opportunity this trip bill.,Peace artist line sort billion nothing beyond true.,,,,,,,,,,,,,,,,,,,,,,,,,,,,,,,,,,,,,,,,,,,,,,,,,,,,,,,,,,,,,,,,,,,,,,,,,,,,,,,,,,,,,,,,,,534.23,4925.27,2976.89,,,,,,,,,,,,,,,,,,,,,,,,,,,,,
655154a8bd3566023058284f,irwinsamuel,2019,December,,,1370.83,665.6,3041.53,,3890.62,,1264.42,,,2005.89,4108.7,,Store alone class standard leader who.,Employee pass respond performance system well.,Return save than system training detail.,Week leg feeling phone keep open.,,,,,,,,,,,,,,,,,,,,,,,,,,,,,,,,,,,,,,,,,,,,,,,,,,,,,,,,,,,,,,,,,,,,,,,,,,,,,,,,,,,,,,,,,,,3903.36,,,,,,,,,,,,,,,,,,,,,,,,,,,,,
655154a8bd35660230582850,irwinsamuel,2019,February,3090.45,,,2721.43,4163.62,1642.24,1007.47,2324.89,1135.24,3324.38,1849.36,1238.3,4685.95,,Democrat two road serious mention whole popular early.,Remember phone control try notice show everything.,Off others to his discover.,Future collection its moment occur together.,Set arrive happen management wish power rise.,Market evening again peace certainly same fall.,True increase day lose produce contain surface.,,,,,,,,,,,,,,,,,,,,,,,,,,,,,,,,,,,,,,,,,,,,,,,,,,,,,,,,,,,,,,,,,,,,,,,,,,,,,,,,,,,,,,964.98,3990.03,,,330.31,,,,,,,,,,,,,,,,,,,,,,,,,,,
655154a8bd35660230582851,irwinsamuel,2019,January,,899.87,3975.7,,1957.97,,4262.74,1146.92,,,,,4084.04,,Step table light.,Short each nice last.,Wonder up religious war shake themselves large.,Audience kid shoulder generation us meeting loss.,Board hit drive shake television administration single.,,,,,,,,,,,,,,,,,,,,,,,,,,,,,,,,,,,,,,,,,,,,,,,,,,,,,,,,,,,,,,,,,,,,,,,,,,,,,,,,,,,,,,,,,737.91,,2286.11,,,,,,,,,,,,,,,,,,,,,,,,,,,,
655154a8bd35660230582852,irwinsamuel,2019,July,2996.62,4955.35,1415.78,,4923.33,2290.33,,,,,3756.23,,,,Whatever senior carry reach rock on despite.,Whole pick prepare hundred man senior will.,Material community reflect.,Enjoy husband reality half Congress with account option.,Actually score Mr wear institution heart conference move.,,,,,,,,,,,,,,,,,,,,,,,,,,,,,,,,,,,,,,,,,,,,,,,,,,,,,,,,,,,,,,,,,,,,,,,,,,,,,,,,,,,,,,,,,726.23,,,,514.45,,,,,,,,,,,,,,,,,,,,,,,,,,
655154a8bd35660230582853,irwinsamuel,2019,June,2908.81,4701.61,3173.68,4750.7,,,4803.28,,,,,3599.26,2131.27,4017.01,Change else child today study idea.,Spring attack number.,Seem career become never main.,First live director.,Stage attack history budget sometimes attention amount.,Operation eye treat message laugh rock.,,,,,,,,,,,,,,,,,,,,,,,,,,,,,,,,,,,,,,,,,,,,,,,,,,,,,,,,,,,,,,,,,,,,,,,,,,,,,,,,,,,,,,,2548.35,,,,,,,,,,,,,,,,,,,,,,,,,,,,,,,
655154a8bd35660230582854,irwinsamuel,2019,March,3308.71,3206.49,2315.83,600.4,4381.97,1828.12,,1532.9,,,3786.94,3449.6,,,Oil mind number economy from until.,Once address traditional sound brother.,Good administration hospital attorney treatment.,Everyone pretty late hair whatever range.,Outside college spend network culture.,Serve home once just half follow throw.,,,,,,,,,,,,,,,,,,,,,,,,,,,,,,,,,,,,,,,,,,,,,,,,,,,,,,,,,,,,,,,,,,,,,,,,,,,,,,,,,,,,,,,,,,2013.12,,,,,,,,,,,,,,,,,,,,,,,,,,,,
655154a8bd35660230582855,irwinsamuel,2019,May,,2690.7,2542.92,4142.4,,,,,2476.8,,,665.63,4720.7,,Person sister evening he sometimes my.,View yourself according include decision five long.,Create ask single author again reveal myself.,Family ago according deep white.,Meeting among camera best growth guess time these.,Medical old mouth.,Never art maintain.,Read a cold finish message.,,,,,,,,,,,,,,,,,,,,,,,,,,,,,,,,,,,,,,,,,,,,,,,,,,,,,,,,,,,,,,,,,,,,,,,,,,,,,,,,,,,,,,,2504.53,1440.6,,,,,,,,,,,,,,,,,,,,,,,,,,,,
655154a8bd35660230582856,irwinsamuel,2019,November,2402.1,3714.85,1208.02,852.69,2691.91,1761.45,,,,,,,,105.27,Southern camera concern woman determine plant site.,Example him statement they only they sing.,Fly need ahead also short cut according learn.,Evidence yes speak make.,Reveal coach news.,Race miss already city up.,Serious hope he agree data various.,,,,,,,,,,,,,,,,,,,,,,,,,,,,,,,,,,,,,,,,,,,,,,,,,,,,,,,,,,,,,,,,,,,,,,,,,,,,,,,,,,,,,,278.76,2386.88,,,,,,,,,,,,,,,,,,,,,,,,,,,,,,
655154a8bd35660230582857,irwinsamuel,2019,October,,,4425.87,,1769.91,4396.88,924.16,,,2236.1,,,4767.06,,Half view home type moment answer structure.,Available thus national cost woman.,,,,,,,,,,,,,,,,,,,,,,,,,,,,,,,,,,,,,,,,,,,,,,,,,,,,,,,,,,,,,,,,,,,,,,,,,,,,,,,,,,,,,,,,,,,3080.29,593.6,,,4334.07,,,,,,,,,,,,,,,,,,,,,,,,,,,
655154a8bd35660230582858,irwinsamuel,2019,September,1310.16,,1334.86,,2225.73,,333.29,,3651.86,383.62,2025.32,3514.89,3766.81,940.43,Significant concern might compare nation support.,Prepare all phone paper environment easy.,Wish view decade interest recognize town son.,From live address expert listen.,Behind lay officer interest others data.,Recent near piece million it conference.,Leg perhaps three little.,,,,,,,,,,,,,,,,,,,,,,,,,,,,,,,,,,,,,,,,,,,,,,,,,,,,,,,,,,,,,,,,,,,,,,,,,,,,,,,,,,,,,,,,3235.48,,3496.9,3551.22,,,,,,,,,,,,,,,,,,,,,,,,,,
655154a8bd35660230582859,irwinsamuel,2020,April,,3336.52,3467.46,4440.82,,,,2521.92,,,4046.54,,,,Thought drop record win account find.,Letter entire clear full.,Rock indicate expect responsibility feeling last rather.,Manager including become fine any why.,Agency federal imagine cultural citizen.,,,,,,,,,,,,,,,,,,,,,,,,,,,,,,,,,,,,,,,,,,,,,,,,,,,,,,,,,,,,,,,,,,,,,,,,,,,,,,,,,,,,,,,,4425.14,,3632.41,,,4822.72,,,,,,,,,,,,,,,,,,,,,,,,,,
655154a8bd3566023058285a,irwinsamuel,2020,August,,193.64,3246.89,,943.39,416.99,,876.06,,1474.72,3978.04,4982.22,4874.12,3098.62,Notice dog maintain performance various herself.,Sign imagine town stand challenge.,Day buy law into.,Establish about more poor bed magazine.,Check sometimes reach main charge agent.,Reduce try staff no high resource what.,Social people half quickly affect clear.,Test two lay.,,,,,,,,,,,,,,,,,,,,,,,,,,,,,,,,,,,,,,,,,,,,,,,,,,,,,,,,,,,,,,,,,,,,,,,,,,,,,,,,,,,,,4021.74,,,1925.35,2613.25,,,,,,,,,,,,,,,,,,,,,,,,,,,
655154a8bd3566023058285b,irwinsamuel,2020,December,712.47,,2640.66,2569.96,,3010.73,,1741.06,,,1604.62,4285.83,,,Carry technology seven me.,Him government music magazine.,Nation let what fly drop spring.,Lead create watch about just.,Everyone case her town agreement.,,,,,,,,,,,,,,,,,,,,,,,,,,,,,,,,,,,,,,,,,,,,,,,,,,,,,,,,,,,,,,,,,,,,,,,,,,,,,,,,,,,,,,,,1538.25,,,3111.59,1027.05,2532.63,,,,,,,,,,,,,,,,,,,,,,,,,,
