655154a8bd356602305826e1,ellenhunter,2015,May,,4949.14,,,2745.37,3962.15,,2601.3,,,,,,,Left bill control study boy moment before benefit.,Almost lawyer third.,Thus over early stage suggest difficult another.,,,,,,,,,,,,,,,,,,,,,,,,,,,,,,,,,,,,,,,,,,,,,,,,,,,,,,,,,,,,,,,,,,,,,,,,,,,,,,,,,,,,,,,,,,2021.65,,,,418.79,,,,,,,,,,,,,,,,,,,,,,,,,,,
655154a8bd356602305826e2,ellenhunter,2015,November,1001.41,,4124.83,,1515.04,1385.65,,4941.36,,501.9,,,,3060.88,Senior nor care build glass.,Four realize under sell anything trial.,Blue himself guess writer example shake relationship evening.,Must year agree here reason become popular course.,Concern drive spend happy.,Forward three nearly natural raise Republican inside.,,,,,,,,,,,,,,,,,,,,,,,,,,,,,,,,,,,,,,,,,,,,,,,,,,,,,,,,,,,,,,,,,,,,,,,,,,,,,,,,,,,,,,,,2082.94,2595.51,216.11,,,,,,,,,,,,,,,,,,,,,,,,,,,,
655154a8bd356602305826e3,ellenhunter,2015,October,,4355.85,,1275.97,4756.17,3968.21,10.76,,,,,,,,Tend house during create according three world.,During customer anything color.,One child month explain citizen guy.,,,,,,,,,,,,,,,,,,,,,,,,,,,,,,,,,,,,,,,,,,,,,,,,,,,,,,,,,,,,,,,,,,,,,,,,,,,,,,,,,,,,,,,,,,,,,4271.77,,,,,,,,,,,,,,,,,,,,,,,,,,,,
655154a8bd356602305826e4,ellenhunter,2015,September,4057.04,,3406.44,1662.49,1637.96,1121.22,290.22,2605.76,,,,,1144.98,3184.78,Wrong street type concern member.,Effort new me structure fine catch remember.,Join power drug enjoy civil benefit far.,Debate morning study simply specific.,Local simple person recent support popular inside.,Protect imagine argue material fine lawyer.,Difficult official hit war technology.,,,,,,,,,,,,,,,,,,,,,,,,,,,,,,,,,,,,,,,,,,,,,,,,,,,,,,,,,,,,,,,,,,,,,,,,,,,,,,,,,,,,,,,,3943.04,,4415.35,,,,,,,,,,,,,,,,,,,,,,,,,,,
655154a8bd356602305826e5,ellenhunter,2016,April,,2720.86,,,,,4910.61,,,3031.8,,741.42,1550.45,,Weight take artist tree.,Opportunity drive offer himself explain unit.,Build civil Republican experience.,Make across really forget spend between.,Still rest relate site door.,,,,,,,,,,,,,,,,,,,,,,,,,,,,,,,,,,,,,,,,,,,,,,,,,,,,,,,,,,,,,,,,,,,,,,,,,,,,,,,,,,,,,,,,3264.21,3439.04,,,,3470.3,,,,,,,,,,,,,,,,,,,,,,,,,,
655154a8bd356602305826e6,ellenhunter,2016,August,501.8,,871.82,1795.62,,4281.62,3888.17,,,930.1,,1748.77,,2497.46,Radio value name article several practice.,Film why must institution pattern feel fight.,Whatever role institution visit move benefit.,Bank line allow history arm strategy experience break.,,,,,,,,,,,,,,,,,,,,,,,,,,,,,,,,,,,,,,,,,,,,,,,,,,,,,,,,,,,,,,,,,,,,,,,,,,,,,,,,,,,,,,,,,,,,,,1949.08,,,,,,,,,,,,,,,,,,,,,,,,,,
655154a8bd356602305826e7,ellenhunter,2016,December,1511.61,,2403.63,,848.37,2139.7,4746.22,3817.83,4038.89,,710.74,3016.79,,,Low speech performance hard.,Threat national economic production well value within.,Author start evening ground environment.,Clear action economic beat study somebody company doctor.,Possible season direction break social weight official try.,Enjoy section much community interest management there leg.,Five available family huge decide century yet.,West project mind food quickly.,,,,,,,,,,,,,,,,,,,,,,,,,,,,,,,,,,,,,,,,,,,,,,,,,,,,,,,,,,,,,,,,,,,,,,,,,,,,,,,,,,,,,,,586.26,,4376.32,,,,,,,,,,,,,,,,,,,,,,,,,,,
655154a8bd356602305826e8,ellenhunter,2016,February,4135.33,,1570.88,4833.15,1377.61,,,2771.88,,378.61,,,,1532.61,Apply box agreement ahead.,Write will bank on laugh own.,Small night cold still.,Though next increase.,Anyone none her whatever.,,,,,,,,,,,,,,,,,,,,,,,,,,,,,,,,,,,,,,,,,,,,,,,,,,,,,,,,,,,,,,,,,,,,,,,,,,,,,,,,,,,,,,,,,,,,,,,,,,,,,,,,,,,,,,,,,,,,,,,
655154a8bd356602305826e9,ellenhunter,2016,January,3714.84,,,,2107.15,,,3902.79,4434.15,,,,4334.14,4451.72,Color big difficult in.,Structure cell sit mention quite laugh.,Almost live call few begin on budget.,Magazine data west shoulder over challenge.,Understand tell piece.,,,,,,,,,,,,,,,,,,,,,,,,,,,,,,,,,,,,,,,,,,,,,,,,,,,,,,,,,,,,,,,,,,,,,,,,,,,,,,,,,,,,,,,,,1491.47,,,,,,,,,,,,,,,,,,,,,,,,,,,,,,
655154a8bd356602305826ea,ellenhunter,2016,July,2198.81,682.41,,284.65,4714.34,834.64,,1277.36,680.12,,,,,,Blood change hot job nothing against.,Notice live continue represent sort.,Anyone bank then.,Forward middle country stock agency need try born.,Contain deep us choice.,Wall no sea wife western street yourself.,Improve language agency night necessary.,,,,,,,,,,,,,,,,,,,,,,,,,,,,,,,,,,,,,,,,,,,,,,,,,,,,,,,,,,,,,,,,,,,,,,,,,,,,,,,,,,,,,,,,,275.95,905.89,,,,,,,,,,,,,,,,,,,,,,,,,,,
655154a8bd356602305826eb,ellenhunter,2016,June,2269.45,4944.44,1721.37,,806.83,,,,,,,,424.08,,Stuff smile decision same.,Official very whom culture how.,Wide degree body prove paper agency job.,Simply science leg well set yet.,,,,,,,,,,,,,,,,,,,,,,,,,,,,,,,,,,,,,,,,,,,,,,,,,,,,,,,,,,,,,,,,,,,,,,,,,,,,,,,,,,,,,,,,,,,,4486.83,,4783.61,,,,,,,,,,,,,,,,,,,,,,,,,,
655154a8bd356602305826ec,ellenhunter,2016,March,2472.43,2797.81,4846.52,1401.27,2763.79,20.52,,,4528.95,,,,,,Get about fund national production team position.,Become remain weight stay.,Likely shake fall their industry standard risk.,Course president tend just.,Cut treatment throw soon southern these.,Professor cost his avoid daughter measure hit.,Occur finish truth option.,Front be thing method send.,Group remember size camera.,Page throughout everyone return worry.,,,,,,,,,,,,,,,,,,,,,,,,,,,,,,,,,,,,,,,,,,,,,,,,,,,,,,,,,,,,,,,,,,,,,,,,,,,,,,,,,,,,3794.29,2591.45,71.44,,,,,,,,,,,,,,,,,,,,,,,,,,,,
655154a8bd356602305826ed,ellenhunter,2016,May,3282.4,3984.26,,4709.73,1931.45,,,1284.62,,1751.65,,,,77.97,Future point position class painting medical goal.,World direction evidence week something create view.,Science generation in treatment I physical seven.,Hit establish knowledge alone field catch school open.,Movie language magazine bar likely may.,Because number interview human left growth base his.,Game standard close.,,,,,,,,,,,,,,,,,,,,,,,,,,,,,,,,,,,,,,,,,,,,,,,,,,,,,,,,,,,,,,,,,,,,,,,,,,,,,,,,,,,,,,3776.14,3423.16,,,,,,,,,,,,,,,,,,,,,,,,,,,,,,
655154a8bd356602305826ee,ellenhunter,2016,November,,2832.9,,794.65,1606.23,4224.5,4557.97,3308.55,3918.68,3789.82,183.95,,,4653.55,Share whom important law can student.,Team why Mrs return.,Film group technology probably reason suffer.,Population information stay door.,Everybody friend professor.,Certainly spend media factor education.,,,,,,,,,,,,,,,,,,,,,,,,,,,,,,,,,,,,,,,,,,,,,,,,,,,,,,,,,,,,,,,,,,,,,,,,,,,,,,,,,,,,,,,,,3604.45,,4997.98,,,,,,,,,,,,,,,,,,,,,,,,,,,
655154a8bd356602305826ef,ellenhunter,2016,October,,,499.31,,273.32,,1175.07,,,2535.42,,,,3294.8,My either study live early society.,Establish month create man wonder past.,Network clearly picture southern must hard.,Subject information wall modern body go.,Safe forward member laugh.,,,,,,,,,,,,,,,,,,,,,,,,,,,,,,,,,,,,,,,,,,,,,,,,,,,,,,,,,,,,,,,,,,,,,,,,,,,,,,,,,,,,,,,,,2408.1,611.69,4386.31,,2782.02,,,,,,,,,,,,,,,,,,,,,,,,,,
655154a8bd356602305826f0,ellenhunter,2016,September,898.11,1294.04,,,3890.91,3963.62,,1470.47,,211.51,,,,2050.39,Value there civil within word.,Idea art system money.,Or prove something live.,Voice gun condition lay various town.,Significant standard nearly drug your bed.,He cup when.,Good door value strong discussion fight some claim.,Girl now bring soon.,,,,,,,,,,,,,,,,,,,,,,,,,,,,,,,,,,,,,,,,,,,,,,,,,,,,,,,,,,,,,,,,,,,,,,,,,,,,,,,,,,,,,,,,4463.17,,,,,,,,,,,,,,,,,,,,,,,,,,,,
655154a8bd356602305826f1,ellenhunter,2017,April,,4860.19,,2916.8,2164.38,18.27,,3852.24,,,2248.45,,1715.91,3479.72,Say newspaper science yeah race those choose.,Hospital significant cause every and.,,,,,,,,,,,,,,,,,,,,,,,,,,,,,,,,,,,,,,,,,,,,,,,,,,,,,,,,,,,,,,,,,,,,,,,,,,,,,,,,,,,,,,,,,,,,,,1502.61,,,,,,,,,,,,,,,,,,,,,,,,,,,,
655154a8bd356602305826f2,ellenhunter,2017,August,890.3,,3788.29,4296.52,314.72,383.44,1293.72,,,,,,,980.96,Natural quite service Democrat spend to.,Keep near series sing management identify level.,Provide wind chance reach.,Product local similar certain or generation.,Teacher about affect visit test professor approach.,Truth our model yard day.,,,,,,,,,,,,,,,,,,,,,,,,,,,,,,,,,,,,,,,,,,,,,,,,,,,,,,,,,,,,,,,,,,,,,,,,,,,,,,,,,,,,,,,1635.21,,2055.35,1379.62,,,,,,,,,,,,,,,,,,,,,,,,,,,,
655154a8bd356602305826f3,ellenhunter,2017,December,4178.15,3459.41,,,125.38,2818.46,,,1270.18,,,1617.46,,3226.78,Need imagine talk green tough.,Hospital head fly look election may.,Nearly north sort radio activity.,,,,,,,,,,,,,,,,,,,,,,,,,,,,,,,,,,,,,,,,,,,,,,,,,,,,,,,,,,,,,,,,,,,,,,,,,,,,,,,,,,,,,,,,,,4929.93,,,305.38,,,,,,,,,,,,,,,,,,,,,,,,,,,,
655154a8bd356602305826f4,ellenhunter,2017,February,2969.57,,1755.26,801.97,,,,4178.25,3232.91,3186.04,,,4410.27,,Project position after throughout industry magazine.,But training thought.,Bed by unit those.,Rise consider fish chair why move.,Finish machine policy sign growth.,Very force possible major respond professor just.,Sea current sport again keep risk.,,,,,,,,,,,,,,,,,,,,,,,,,,,,,,,,,,,,,,,,,,,,,,,,,,,,,,,,,,,,,,,,,,,,,,,,,,,,,,,,,,,,,,195.72,1347.74,,2430.66,,,,,,,,,,,,,,,,,,,,,,,,,,,,
655154a8bd356602305826f5,ellenhunter,2017,January,3658.9,,4848.24,1965.63,,388.9,1864.45,,,,,1680.21,,1451.41,Live much before.,Consider consumer up he detail.,Significant wall herself.,Those but return organization cut peace.,Painting decision little guess main.,Avoid American south talk collection.,,,,,,,,,,,,,,,,,,,,,,,,,,,,,,,,,,,,,,,,,,,,,,,,,,,,,,,,,,,,,,,,,,,,,,,,,,,,,,,,,,,,,,,,4484.57,,,3556.32,,,,,,,,,,,,,,,,,,,,,,,,,,,
655154a8bd356602305826f6,ellenhunter,2017,July,,4335.8,,2819.1,2771.31,1241.74,,,,,,286.48,,,Husband table rich leader.,Either future billion pull each industry well seven.,East prevent dark consider structure.,Alone hospital out create.,Budget skin prepare throughout few nor mind hundred.,Name official price.,,,,,,,,,,,,,,,,,,,,,,,,,,,,,,,,,,,,,,,,,,,,,,,,,,,,,,,,,,,,,,,,,,,,,,,,,,,,,,,,,,,,,,,,304.8,,,2007.34,4792.61,,,,,,,,,,,,,,,,,,,,,,,,,,
655154a8bd356602305826f7,ellenhunter,2017,June,2981.19,,2445.44,,,2579.72,,3411.73,,,,,,,Wait serious college many.,White southern reduce most.,Analysis all participant.,Toward himself away the none.,Forward serve husband.,Success require protect natural health before.,,,,,,,,,,,,,,,,,,,,,,,,,,,,,,,,,,,,,,,,,,,,,,,,,,,,,,,,,,,,,,,,,,,,,,,,,,,,,,,,,,,,,,,,4413.26,4120.23,1192.79,246.76,3309.78,,,,,,,,,,,,,,,,,,,,,,,,,,
655154a8bd356602305826f8,ellenhunter,2017,March,1299.78,,4627.45,3844.42,2371.36,4934.27,3603.32,1778.54,,,,,4979.2,3208.49,Student simply bank pick.,Analysis look very thousand again company truth.,This begin east its person challenge.,Away politics catch break decide than.,Themselves like risk second check study.,Least concern former reflect walk trip.,Sister put very.,Church order culture believe four.,,,,,,,,,,,,,,,,,,,,,,,,,,,,,,,,,,,,,,,,,,,,,,,,,,,,,,,,,,,,,,,,,,,,,,,,,,,,,,,,,,,,,,,1389.19,1155.72,1515.25,2478.96,,,,,,,,,,,,,,,,,,,,,,,,,,
655154a8bd356602305826f9,ellenhunter,2017,May,,3560.24,2467.92,,,,4141.81,4263.24,4966.95,1733.64,,2167.35,,225.66,Behavior word join seem little relationship college from.,Travel education suffer another society expert.,Why health TV future offer meet.,Make tree trial fall particular guess item.,Still science safe firm end.,,,,,,,,,,,,,,,,,,,,,,,,,,,,,,,,,,,,,,,,,,,,,,,,,,,,,,,,,,,,,,,,,,,,,,,,,,,,,,,,,,,,,,,,,,,,,,,,,,,,,,,,,,,,,,,,,,,,,,,
655154a8bd356602305826fa,ellenhunter,2017,November,872.01,,1919.17,2990.47,,2620.83,,4291.11,,,4631.13,3723.16,,,True help anything experience itself.,Check ask action main deal tonight candidate interest.,Help step international who bring.,Tell choose course paper spend affect save seven.,Three then method environment no.,Upon sing fall American happy.,Foreign nearly reach.,Thank also future each to how.,,,,,,,,,,,,,,,,,,,,,,,,,,,,,,,,,,,,,,,,,,,,,,,,,,,,,,,,,,,,,,,,,,,,,,,,,,,,,,,,,,,,,,,,,,,,,,,,,,,,,,,,,,,,,,,,,,,,
655154a8bd356602305826fb,ellenhunter,2017,October,101.08,4022.03,390.64,2180.06,3290.49,,2229.26,1928.46,,,,,1281.79,277.02,But pass approach over difficult participant art.,Upon increase reduce about record machine whole claim.,News pressure beyond summer technology society.,Travel involve role.,Fill stock air girl.,Board rule tree fish red strong left.,Necessary imagine produce feel deal place life.,Since allow meeting eat break open.,,,,,,,,,,,,,,,,,,,,,,,,,,,,,,,,,,,,,,,,,,,,,,,,,,,,,,,,,,,,,,,,,,,,,,,,,,,,,,,,,,,,,3520.05,,,,2360.58,,,,,,,,,,,,,,,,,,,,,,,,,,,
655154a8bd356602305826fc,ellenhunter,2017,September,519.72,2958.36,,,,3904.5,694.03,,1929.37,1781.84,,,1258.61,4105.08,Talk heavy hit tough sometimes strong.,Only right score future group lot.,Because see both century involve get.,East put pull adult certainly ball.,Final animal military culture quality.,Catch car strong reason despite among among.,Force rock matter environment phone discover important.,Mission put put various inside camera soon.,Hard decide century edge.,This oil else animal.,,,,,,,,,,,,,,,,,,,,,,,,,,,,,,,,,,,,,,,,,,,,,,,,,,,,,,,,,,,,,,,,,,,,,,,,,,,,,,,,,,,,2801.84,3438.53,,107.17,,,,,,,,,,,,,,,,,,,,,,,,,,,
655154a8bd356602305826fd,ellenhunter,2018,April,,,,,3731.42,,,2035.03,,3796.19,,3969.87,2096.3,3223.54,Late hear friend.,Born vote perform at final research.,Effort identify specific official near either financial.,Citizen term actually to wife film open.,Best government attention address image class their.,,,,,,,,,,,,,,,,,,,,,,,,,,,,,,,,,,,,,,,,,,,,,,,,,,,,,,,,,,,,,,,,,,,,,,,,,,,,,,,,,,,,,,,,2355.36,1511.87,590.1,4619.41,,,,,,,,,,,,,,,,,,,,,,,,,,,,
655154a8bd356602305826fe,ellenhunter,2018,August,4875.23,,1180.67,,,465.15,1309.25,3442.86,,,2409.22,,,,Operation provide usually wrong throw old year.,Against serious southern out describe strong human officer.,Somebody gas his loss must mean sound.,Treat parent fish leader similar get.,,,,,,,,,,,,,,,,,,,,,,,,,,,,,,,,,,,,,,,,,,,,,,,,,,,,,,,,,,,,,,,,,,,,,,,,,,,,,,,,,,,,,,,,,,,,,2081.41,,,,,,,,,,,,,,,,,,,,,,,,,,,
655154a8bd356602305826ff,ellenhunter,2018,December,,85.27,4723.04,538.72,4900.55,2826.01,,2462.43,,,4905.11,,,,Raise property material laugh stage.,Life remain stuff structure stage try.,All behavior real month dinner vote fire give.,Mission already TV note could ahead.,Live rise small indeed.,,,,,,,,,,,,,,,,,,,,,,,,,,,,,,,,,,,,,,,,,,,,,,,,,,,,,,,,,,,,,,,,,,,,,,,,,,,,,,,,,,,,,,,,475.54,,,,,,,,,,,,,,,,,,,,,,,,,,,,,,,
655154a8bd35660230582700,ellenhunter,2018,February,2461.28,,,,,80.2,4038.8,,,1144.1,,,,784.26,Majority give our radio hour ever.,Of interview television have figure forward do decide.,Painting public trial soon.,Become recent speech wonder thank wear find.,,,,,,,,,,,,,,,,,,,,,,,,,,,,,,,,,,,,,,,,,,,,,,,,,,,,,,,,,,,,,,,,,,,,,,,,,,,,,,,,,,,,,,,,,2478.83,,,,,,,,,,,,,,,,,,,,,,,,,,,,,,,
655154a8bd35660230582701,ellenhunter,2018,January,600.41,,3570.81,2730.41,4700.77,,,,,3917.03,,,,,Figure argue manager any heart ready difference.,Manage loss expert.,Radio week edge performance.,Interview here last second.,Side contain firm food best best.,,,,,,,,,,,,,,,,,,,,,,,,,,,,,,,,,,,,,,,,,,,,,,,,,,,,,,,,,,,,,,,,,,,,,,,,,,,,,,,,,,,,,,,,895.2,4204.04,2458.62,,,4191.77,,,,,,,,,,,,,,,,,,,,,,,,,,
655154a8bd35660230582702,ellenhunter,2018,July,932.93,3496.75,4117.67,,2396.97,1073,,,398.95,,4271.58,1362.61,,,Occur over check one.,Though true peace boy produce coach war just.,I wrong more think someone career student.,Charge system again.,Bring part black message.,,,,,,,,,,,,,,,,,,,,,,,,,,,,,,,,,,,,,,,,,,,,,,,,,,,,,,,,,,,,,,,,,,,,,,,,,,,,,,,,,,,,,,,,,,,,3963.77,,,,,,,,,,,,,,,,,,,,,,,,,,,
655154a8bd35660230582703,ellenhunter,2018,June,,,,4628.29,,309.72,2820.84,,,,1258.87,,,,Of issue your character.,,,,,,,,,,,,,,,,,,,,,,,,,,,,,,,,,,,,,,,,,,,,,,,,,,,,,,,,,,,,,,,,,,,,,,,,,,,,,,,,,,,,,,,,,,,,,,,4550.19,4521.95,,,,,,,,,,,,,,,,,,,,,,,,,,,
655154a8bd35660230582704,ellenhunter,2018,March,4318.71,,186.16,422.5,,1237.46,,,,3409.14,,3555.06,,3742.62,Both kid economic understand.,Artist second morning project.,Chance strong arrive music customer vote we.,Travel five already billion.,Sell argue choice true movie dark others.,Under step current include.,Eat lawyer child theory population government early.,Growth quality environmental yeah in.,Summer today democratic machine if then put.,Hard movie personal tax break get garden.,,,,,,,,,,,,,,,,,,,,,,,,,,,,,,,,,,,,,,,,,,,,,,,,,,,,,,,,,,,,,,,,,,,,,,,,,,,,,,,,,,,4609.52,,3667.99,,,,,,,,,,,,,,,,,,,,,,,,,,,,,
655154a8bd35660230582705,ellenhunter,2018,May,4069.01,,,1116.88,,104.26,2417.79,,1843.94,,4320.49,4908.88,,2545.25,Person compare and industry edge hair.,Yet rather figure value then pay seat moment.,Baby community old produce prove.,,,,,,,,,,,,,,,,,,,,,,,,,,,,,,,,,,,,,,,,,,,,,,,,,,,,,,,,,,,,,,,,,,,,,,,,,,,,,,,,,,,,,,,,,,,,,,1990.22,4278.42,,,,,,,,,,,,,,,,,,,,,,,,,,
655154a8bd35660230582706,ellenhunter,2018,November,,1830.82,976.63,3652.8,2085.25,,,4185.49,,,3597.14,,,,Help bring together from federal fund.,Law own book idea.,Bit able prove.,Open business responsibility world could wrong.,,,,,,,,,,,,,,,,,,,,,,,,,,,,,,,,,,,,,,,,,,,,,,,,,,,,,,,,,,,,,,,,,,,,,,,,,,,,,,,,,,,,,,,,,3246.71,,,,,,,,,,,,,,,,,,,,,,,,,,,,,,,
655154a8bd35660230582707,ellenhunter,2018,October,2861.51,,4156.6,3508.39,969.36,,,1627.6,,3200.85,2419.01,4253.11,,,Determine area land enjoy country card clearly something.,Down condition responsibility their.,Note billion pressure if.,Create bill dream half successful cultural forget option.,Bag room read like my analysis card.,Teach administration avoid ability next firm green type.,,,,,,,,,,,,,,,,,,,,,,,,,,,,,,,,,,,,,,,,,,,,,,,,,,,,,,,,,,,,,,,,,,,,,,,,,,,,,,,,,,,,,,,2804.74,2240.81,,1966.74,,,,,,,,,,,,,,,,,,,,,,,,,,,,
655154a8bd35660230582708,ellenhunter,2018,September,,787.84,3712.4,2906.25,3783.49,,,4139.6,,139.68,,,,4242.35,Day black could everyone idea simply company.,,,,,,,,,,,,,,,,,,,,,,,,,,,,,,,,,,,,,,,,,,,,,,,,,,,,,,,,,,,,,,,,,,,,,,,,,,,,,,,,,,,,,,,,,,,,,,,,4747.68,,,,,,,,,,,,,,,,,,,,,,,,,,,
655154a8bd35660230582709,ellenhunter,2019,April,1511.55,1613.79,4276.55,,,2554.56,,,,560.97,,2327.28,,4146.6,Form cold real town discussion simply.,Brother wide forward trade maintain by.,Choice money employee morning require kitchen with like.,,,,,,,,,,,,,,,,,,,,,,,,,,,,,,,,,,,,,,,,,,,,,,,,,,,,,,,,,,,,,,,,,,,,,,,,,,,,,,,,,,,,,,,,,,,,1027.22,2119.35,192.8,,,,,,,,,,,,,,,,,,,,,,,,,,,
655154a8bd3566023058270a,ellenhunter,2019,August,,1893.65,2148.86,,45.33,990.68,,4183.93,4212.53,,,,1613.74,,Water figure long could despite.,Lose speak ago truth exist result.,Free light leg time mention.,Agency both opportunity long position nor population.,Majority Mrs after quickly.,,,,,,,,,,,,,,,,,,,,,,,,,,,,,,,,,,,,,,,,,,,,,,,,,,,,,,,,,,,,,,,,,,,,,,,,,,,,,,,,,,,,,,,,,,4938.57,,180.11,,,,,,,,,,,,,,,,,,,,,,,,,,,
655154a8bd3566023058270b,ellenhunter,2019,December,3018.49,2934.18,,4755.72,,133.53,1500.92,3314.9,,4836.81,1077.07,,,3944.32,Road state among market.,Information language everybody herself open suggest.,See out economic reach wear would ready.,Long particular site watch discuss page appear media.,Despite ask short throw education write eat rock.,Police although PM for city current.,Animal by best likely professor.,Character idea physical.,Mission government last build nor.,Recent maybe its information seek.,,,,,,,,,,,,,,,,,,,,,,,,,,,,,,,,,,,,,,,,,,,,,,,,,,,,,,,,,,,,,,,,,,,,,,,,,,,,,,,,,,,,4709.47,,,,,,,,,,,,,,,,,,,,,,,,,,,,,,
655154a8bd3566023058270c,ellenhunter,2019,February,,3555.71,,,1737.8,,,,3999.24,2787.03,,,,826.47,Job any way car agreement perhaps own.,Attention without nature.,Contain price thank church score worker notice.,How firm opportunity.,Eye huge machine mission meeting.,,,,,,,,,,,,,,,,,,,,,,,,,,,,,,,,,,,,,,,,,,,,,,,,,,,,,,,,,,,,,,,,,,,,,,,,,,,,,,,,,,,,,,,,1026.37,,107.36,1227.33,3720.73,3131.78,,,,,,,,,,,,,,,,,,,,,,,,,,
655154a8bd3566023058270d,ellenhunter,2019,January,1292.04,485.02,,864.59,3214.27,749.21,,1100.92,3392.61,3970.78,,,3646.38,,Population magazine whose key among friend one.,Group significant focus seem relationship country.,Force figure design sport.,Compare become forward money act energy group.,Player kid firm everybody growth right.,Building rate radio low.,Free including and purpose brother.,Year part relate practice hope.,Which natural chance attack challenge front much more.,,,,,,,,,,,,,,,,,,,,,,,,,,,,,,,,,,,,,,,,,,,,,,,,,,,,,,,,,,,,,,,,,,,,,,,,,,,,,,,,,,,,432,,1389.5,2835.97,4375.11,,,,,,,,,,,,,,,,,,,,,,,,,,,
655154a8bd3566023058270e,ellenhunter,2019,July,3182.37,121.09,3848.65,3229.38,4102.6,2975.82,3199.69,,,,1800.67,,,,Get ever current fear.,Law baby baby campaign let knowledge nor.,Serve budget record because who.,Plant worker cup affect here order door.,,,,,,,,,,,,,,,,,,,,,,,,,,,,,,,,,,,,,,,,,,,,,,,,,,,,,,,,,,,,,,,,,,,,,,,,,,,,,,,,,,,,,,,,,,,,,,,,,,,,,,,,,,,,,,,,,,,,,,,,
655154a8bd3566023058270f,ellenhunter,2019,June,1140.45,3438.14,,1763.97,2069.13,520.73,,,,,,2694.54,641.22,4801.83,Strategy world indicate only since I data.,News finish large win security know never.,Degree environment main Republican weight rise.,Occur scientist newspaper begin might.,Cover turn least natural together off benefit reduce.,Hold support raise herself size institution central soon.,My agency size history pull push.,,,,,,,,,,,,,,,,,,,,,,,,,,,,,,,,,,,,,,,,,,,,,,,,,,,,,,,,,,,,,,,,,,,,,,,,,,,,,,,,,,,,,,3859.27,,,,,,,,,,,,,,,,,,,,,,,,,,,,,,,
655154a8bd35660230582710,ellenhunter,2019,March,2259.74,2498.06,4782.74,,2453.37,2942.78,66.51,,,1372.13,,,,947.65,Population own could adult each seek study.,Model address half someone.,Already smile between cover ask can however.,Market lawyer doctor why action time.,Score seem during huge.,Camera sit Republican consider return daughter.,Send court set seem reveal toward.,Vote picture ok.,Choice receive station tonight skin hold against.,,,,,,,,,,,,,,,,,,,,,,,,,,,,,,,,,,,,,,,,,,,,,,,,,,,,,,,,,,,,,,,,,,,,,,,,,,,,,,,,,,,,,1514.25,,,90.48,143.14,,,,,,,,,,,,,,,,,,,,,,,,,,
655154a8bd35660230582711,ellenhunter,2019,May,3197.29,1419.81,536.95,253.01,4840.84,,,4904.85,,,,581.4,873.51,,Share it thousand how enter line performance senior.,All heart rock figure while.,Thus we huge Republican ago.,Lawyer party around personal less tonight far.,Build four fund president.,Information pick no nature school.,Analysis class own true throughout.,Bill none Mrs enough administration eye home.,,,,,,,,,,,,,,,,,,,,,,,,,,,,,,,,,,,,,,,,,,,,,,,,,,,,,,,,,,,,,,,,,,,,,,,,,,,,,,,,,,,,,3460.07,4410.1,,4000.31,,,,,,,,,,,,,,,,,,,,,,,,,,,,
655154a8bd35660230582712,ellenhunter,2019,November,,,3874.57,,1883.96,4381.93,,3907.47,,3251.73,,2224.36,3871.75,,Gas investment kid indeed.,Mr manager them cultural early.,Serve kind I.,Would compare us.,History star surface.,Down area especially together church realize.,We interview after energy why easy develop give.,,,,,,,,,,,,,,,,,,,,,,,,,,,,,,,,,,,,,,,,,,,,,,,,,,,,,,,,,,,,,,,,,,,,,,,,,,,,,,,,,,,,,,,,1398.53,3025.39,,,,,,,,,,,,,,,,,,,,,,,,,,,,
655154a8bd35660230582713,ellenhunter,2019,October,,,,4566.22,95.66,4875.24,,2097.29,319.1,,1517.26,2704.56,,2423.47,Draw dark money put unit.,Assume name partner view fly send apply.,Produce tax worry with mind magazine budget.,,,,,,,,,,,,,,,,,,,,,,,,,,,,,,,,,,,,,,,,,,,,,,,,,,,,,,,,,,,,,,,,,,,,,,,,,,,,,,,,,,,,,,,,,,683.41,,,,,,,,,,,,,,,,,,,,,,,,,,,,,,,
655154a8bd35660230582714,ellenhunter,2019,September,3050.74,3016.6,,1547.97,1971.7,1886.9,,,,,2325.93,957.77,901.5,,Husband bad human fact individual area.,Language purpose ground near western.,If cultural catch woman writer.,Situation great eight cultural.,Shake tree media hot field land Mr how.,Big toward science year.,Learn her act campaign window speak each western.,Kind difference question our thus yourself.,Involve official state skill company popular base.,High interesting stop red.,,,,,,,,,,,,,,,,,,,,,,,,,,,,,,,,,,,,,,,,,,,,,,,,,,,,,,,,,,,,,,,,,,,,,,,,,,,,,,,,,,,2400.99,,,3383.09,4892.17,,,,,,,,,,,,,,,,,,,,,,,,,,,
655154a8bd35660230582715,ellenhunter,2020,April,,,1577.64,4947.44,4560.96,2153.05,,,,,3837.31,,2633.11,,These seven quite meeting modern.,More probably must never fight across.,And hospital range weight begin allow apply.,Book administration process concern pretty.,House threat store long myself fly.,,,,,,,,,,,,,,,,,,,,,,,,,,,,,,,,,,,,,,,,,,,,,,,,,,,,,,,,,,,,,,,,,,,,,,,,,,,,,,,,,,,,,,,,2766.42,,,,13.39,,,,,,,,,,,,,,,,,,,,,,,,,,,
655154a8bd35660230582716,ellenhunter,2020,August,,,,3079.81,2713.52,773.61,,4454.64,3455.45,4450.34,,,3824.72,,Job carry cover owner window.,To discussion agree low election world example.,Fine five can room trial soon hope.,Throughout whom single surface purpose hotel.,Resource attorney list four after possible.,Bed Congress modern small radio something tell maintain.,,,,,,,,,,,,,,,,,,,,,,,,,,,,,,,,,,,,,,,,,,,,,,,,,,,,,,,,,,,,,,,,,,,,,,,,,,,,,,,,,,,,,,,1316.39,2696.28,,4600.36,,2352.5,,,,,,,,,,,,,,,,,,,,,,,,,,
655154a8bd35660230582717,ellenhunter,2020,December,,,4250.32,1810.69,,,,,346.21,,,351.52,2512.99,,Environmental number floor affect somebody cost.,Until office himself.,Bill different hotel.,,,,,,,,,,,,,,,,,,,,,,,,,,,,,,,,,,,,,,,,,,,,,,,,,,,,,,,,,,,,,,,,,,,,,,,,,,,,,,,,,,,,,,,,,,3941.15,,888.73,,316.11,,,,,,,,,,,,,,,,,,,,,,,,,,,
655154a8bd35660230582718,ellenhunter,2020,February,1190.5,3533.55,1920.43,4061.55,,4705.08,3203.09,236.27,,3865.53,,,,2933.98,Who democratic different interest participant know among.,Or threat some reason close.,Crime child believe then he perform style.,Data find data audience month anyone technology.,Themselves reason sound kind.,,,,,,,,,,,,,,,,,,,,,,,,,,,,,,,,,,,,,,,,,,,,,,,,,,,,,,,,,,,,,,,,,,,,,,,,,,,,,,,,,,,,,,,,,,830.44,,,,,,,,,,,,,,,,,,,,,,,,,,,,,
