655154a8bd35660230582936,lsalazar,2020,July,,,2887.05,,3468.95,1824.73,1073.91,3999.83,3603.45,,,2387.48,,2414.96,Hard area service glass.,Certain wonder many do law.,Hand last bar tell cause everybody.,So unit manager see five.,Head pressure value always perhaps coach.,Affect test it man.,,,,,,,,,,,,,,,,,,,,,,,,,,,,,,,,,,,,,,,,,,,,,,,,,,,,,,,,,,,,,,,,,,,,,,,,,,,,,,,,,,,,,,,,4659.53,4206.29,83.2,3888.59,,,,,,,,,,,,,,,,,,,,,,,,,,,
655154a8bd35660230582937,lsalazar,2020,June,411.5,2641.67,,738.54,1641.13,3650.78,309.97,,,,,,2219.04,,Thousand summer important total better.,Home focus billion prevent size follow.,Produce appear another car standard arrive.,Player step sure explain reality foot ready.,,,,,,,,,,,,,,,,,,,,,,,,,,,,,,,,,,,,,,,,,,,,,,,,,,,,,,,,,,,,,,,,,,,,,,,,,,,,,,,,,,,,,,,,,,,,,522.4,398.13,,,,,,,,,,,,,,,,,,,,,,,,,,
655154a8bd35660230582938,lsalazar,2020,March,,,897.01,613.94,1838.63,,208.4,,2004.44,,366.07,,,454.96,Activity activity lead no data past prevent.,Purpose group safe in personal century.,Read you west.,Economic later feeling speak third success white.,Year worker tough environmental.,Herself difference easy soldier key.,,,,,,,,,,,,,,,,,,,,,,,,,,,,,,,,,,,,,,,,,,,,,,,,,,,,,,,,,,,,,,,,,,,,,,,,,,,,,,,,,,,,,,,,,,,578.41,2814.77,,,,,,,,,,,,,,,,,,,,,,,,,,
655154a8bd35660230582939,lsalazar,2020,May,4249.84,4965.89,,1178.25,,399.77,,,,,,,,4176.19,Bed bed simple treatment.,Realize hour develop training must.,President record however character task toward something.,Trip sort plant reason level system.,Indeed happy and almost matter.,Indicate friend white ever program step media.,Court general big leg field office.,Could reveal blood.,,,,,,,,,,,,,,,,,,,,,,,,,,,,,,,,,,,,,,,,,,,,,,,,,,,,,,,,,,,,,,,,,,,,,,,,,,,,,,,,,,,,,,2082.26,,1147,,,,,,,,,,,,,,,,,,,,,,,,,,,,
655154a8bd3566023058293a,lsalazar,2020,November,,63.04,,1782.34,2063.42,,651.6,,,645.09,4548.5,,1532.56,,Ok PM boy test according.,Institution president design over foot huge significant appear.,Attention article five who.,Around whom something despite peace claim generation.,Which interview pick most section hear bring.,Major read key turn indicate way government involve.,Approach one card suffer consumer.,Get property interesting plan.,,,,,,,,,,,,,,,,,,,,,,,,,,,,,,,,,,,,,,,,,,,,,,,,,,,,,,,,,,,,,,,,,,,,,,,,,,,,,,,,,,,,,,4917.4,3999.53,3392.41,,4172.33,,,,,,,,,,,,,,,,,,,,,,,,,,
655154a8bd3566023058293b,lsalazar,2020,October,,,,456.84,2602.22,2446.23,,,270.25,,,2609.59,,,Hotel property TV lot really size.,Option direction majority instead common.,Although company impact perhaps own necessary.,Table whose central.,,,,,,,,,,,,,,,,,,,,,,,,,,,,,,,,,,,,,,,,,,,,,,,,,,,,,,,,,,,,,,,,,,,,,,,,,,,,,,,,,,,,,,,,,,,,26.2,4521.55,,,,,,,,,,,,,,,,,,,,,,,,,,,
655154a8bd3566023058293c,lsalazar,2020,September,,4089.8,,1033.96,3914.03,,,2043.16,,38.99,2177.34,,,,Head camera action increase song thousand free.,Poor letter prepare note something.,Life they hair doctor.,Mrs computer interesting born girl yard.,Car word real letter.,,,,,,,,,,,,,,,,,,,,,,,,,,,,,,,,,,,,,,,,,,,,,,,,,,,,,,,,,,,,,,,,,,,,,,,,,,,,,,,,,,,,,,,,,,1845.46,3301.12,4540.21,,,,,,,,,,,,,,,,,,,,,,,,,,,
655154a8bd3566023058293d,lsalazar,2021,April,742.17,1992.97,4808.8,1630.67,,2632.04,,,1726.17,,,,,,Edge dog there control their.,Likely expect money year do example crime million.,,,,,,,,,,,,,,,,,,,,,,,,,,,,,,,,,,,,,,,,,,,,,,,,,,,,,,,,,,,,,,,,,,,,,,,,,,,,,,,,,,,,,,,,,,,1749.17,,3265.54,,723.91,,,,,,,,,,,,,,,,,,,,,,,,,,,
655154a8bd3566023058293e,lsalazar,2021,August,,3428.18,,3311.48,1952.64,,,,,,,,,257.12,Enter mission friend appear cost.,Hand no different single evening care.,Mrs lot physical fire cause can agree answer.,Coach fast garden miss writer.,Admit amount father.,,,,,,,,,,,,,,,,,,,,,,,,,,,,,,,,,,,,,,,,,,,,,,,,,,,,,,,,,,,,,,,,,,,,,,,,,,,,,,,,,,,,,,,,,,,4446.5,3669.08,,,,,,,,,,,,,,,,,,,,,,,,,,,
655154a8bd3566023058293f,lsalazar,2021,December,,3401.15,1535.85,2203.47,,,660.54,,616.19,,,,,3153.65,Allow health form threat difficult weight always.,Cost ready special defense ten successful particularly.,,,,,,,,,,,,,,,,,,,,,,,,,,,,,,,,,,,,,,,,,,,,,,,,,,,,,,,,,,,,,,,,,,,,,,,,,,,,,,,,,,,,,,,,,,,,,413.67,,,714.3,,,,,,,,,,,,,,,,,,,,,,,,,,
655154a8bd35660230582940,lsalazar,2021,February,214.14,,3633.81,1634.19,2964.35,2339.52,,,,,,,,,Evening middle learn admit individual plan bag turn.,Perhaps human middle return.,Front federal live explain several lead.,But whose enough may race.,,,,,,,,,,,,,,,,,,,,,,,,,,,,,,,,,,,,,,,,,,,,,,,,,,,,,,,,,,,,,,,,,,,,,,,,,,,,,,,,,,,,,,,,,,108.2,,639.51,4544.14,,,,,,,,,,,,,,,,,,,,,,,,,,,
655154a8bd35660230582941,lsalazar,2021,January,,1645.56,,,517.85,,,,,2223.39,,3545.22,2046.23,1463.73,Direction do foreign.,Stand among how half us.,Fine administration too structure black.,Trial where bill middle check than others.,,,,,,,,,,,,,,,,,,,,,,,,,,,,,,,,,,,,,,,,,,,,,,,,,,,,,,,,,,,,,,,,,,,,,,,,,,,,,,,,,,,,,,,,,,,,,,3888.81,,,,,,,,,,,,,,,,,,,,,,,,,,
655154a8bd35660230582942,lsalazar,2021,July,2538.69,2675.37,2272.57,4214.47,479.44,2133.11,,,4174.74,,,4511.16,,,Try cell partner better door shoulder arrive.,Young state including stage.,Option time fly space wide yeah clear.,Whatever quality organization successful stay soon.,Never yet require.,Remain president section else many.,Effect town society behavior compare institution.,Them federal bring network write let.,Religious effort present world.,,,,,,,,,,,,,,,,,,,,,,,,,,,,,,,,,,,,,,,,,,,,,,,,,,,,,,,,,,,,,,,,,,,,,,,,,,,,,,,,,,,,1516.19,1100.58,,,,371.35,,,,,,,,,,,,,,,,,,,,,,,,,,
655154a8bd35660230582943,lsalazar,2021,June,,,2855.1,3357.54,993.87,634.75,3401.33,,4727.61,,,,,,Board identify between hour room go song.,White admit program imagine with control that.,Or which fight the this.,Day agreement current fact rock state.,Address director push impact spend financial.,,,,,,,,,,,,,,,,,,,,,,,,,,,,,,,,,,,,,,,,,,,,,,,,,,,,,,,,,,,,,,,,,,,,,,,,,,,,,,,,,,,,,,,,,,1475.81,4762.96,,,,,,,,,,,,,,,,,,,,,,,,,,,,
655154a8bd35660230582944,lsalazar,2021,March,608.71,4165.77,1384.98,1595.49,,,,,,,,1881.53,,,Develop expert lead decision throughout conference wall.,Degree war yes property.,Voice pressure attention bit family bed.,Still or future nature.,Long prevent story power amount issue establish.,Establish door full.,Skin director him human letter military total.,,,,,,,,,,,,,,,,,,,,,,,,,,,,,,,,,,,,,,,,,,,,,,,,,,,,,,,,,,,,,,,,,,,,,,,,,,,,,,,,,,,,,,,1340.06,3609.72,,,,,,,,,,,,,,,,,,,,,,,,,,,,,
655154a8bd35660230582945,lsalazar,2021,May,1809.33,,862.5,3982.7,1438.36,,2723.06,,606.19,4612.71,,,,,Face or another sister among.,Deal report building car produce.,Range community situation stop community rather live.,Rise they development important.,From defense without stay require travel.,,,,,,,,,,,,,,,,,,,,,,,,,,,,,,,,,,,,,,,,,,,,,,,,,,,,,,,,,,,,,,,,,,,,,,,,,,,,,,,,,,,,,,,,,,,,,,,,,,,,,,,,,,,,,,,,,,,,,,,
655154a8bd35660230582946,lsalazar,2021,November,,3835.78,2405.18,713.9,,580.92,,,3445.75,,1574.49,,1330.01,2450.59,Grow painting hospital almost their get.,Yard report certain public song key they.,Both central poor also imagine.,Sometimes people good than.,Herself power single east police artist.,Born sport effort gas need consumer.,Election other around brother nature.,,,,,,,,,,,,,,,,,,,,,,,,,,,,,,,,,,,,,,,,,,,,,,,,,,,,,,,,,,,,,,,,,,,,,,,,,,,,,,,,,,,,,,,,,,2947.12,,,,,,,,,,,,,,,,,,,,,,,,,,,
655154a8bd35660230582947,lsalazar,2021,October,703.39,,,2332.13,1050.64,,,,,868.51,,2948.06,4719.73,,If response wife sea community.,Detail local enter know scientist health consider since.,Blue you the piece section.,,,,,,,,,,,,,,,,,,,,,,,,,,,,,,,,,,,,,,,,,,,,,,,,,,,,,,,,,,,,,,,,,,,,,,,,,,,,,,,,,,,,,,,,,,,2223.79,,4778.44,,4305.75,,,,,,,,,,,,,,,,,,,,,,,,,,
655154a8bd35660230582948,lsalazar,2021,September,1665.94,2078.48,165.54,3473.66,679.44,3625.42,3192.72,3363.55,,,,,,,Range fall place Congress fire age.,Today professor yet artist blood affect science.,Resource goal range pay material draw.,Threat look tax land.,Store strong than onto apply.,Democrat outside resource common whose wish practice book.,,,,,,,,,,,,,,,,,,,,,,,,,,,,,,,,,,,,,,,,,,,,,,,,,,,,,,,,,,,,,,,,,,,,,,,,,,,,,,,,,,,,,,,,,961.36,1218.71,,,,,,,,,,,,,,,,,,,,,,,,,,,,
655154a8bd35660230582949,lsalazar,2022,April,,4938.68,,3031.39,93.85,2782.44,,2672.99,,4859.44,4722.94,,,4303.42,Born lead pull late.,Attorney feel fish religious themselves political sea.,West story suggest factor effect.,Street shoulder board begin parent bed carry.,Car seat its big.,Quickly need manage give game friend.,,,,,,,,,,,,,,,,,,,,,,,,,,,,,,,,,,,,,,,,,,,,,,,,,,,,,,,,,,,,,,,,,,,,,,,,,,,,,,,,,,,,,,,,,,,441.58,,,,,,,,,,,,,,,,,,,,,,,,,,,
655154a8bd3566023058294a,lsalazar,2022,August,,,,3036.29,503.1,,,,4227.46,750.79,2424.33,4716.24,,1596.7,Suggest four save think radio course current.,Their threat alone song.,End husband movie.,Clear them growth receive.,Society protect key much American administration coach or.,Show step grow positive professor.,Find prove type.,,,,,,,,,,,,,,,,,,,,,,,,,,,,,,,,,,,,,,,,,,,,,,,,,,,,,,,,,,,,,,,,,,,,,,,,,,,,,,,,,,,,,,,3574.24,1436.04,,2334.84,,,,,,,,,,,,,,,,,,,,,,,,,,,
655154a8bd3566023058294b,lsalazar,2022,December,4733.2,253.46,,297.38,,,,,,,1869.13,3466.31,4333.24,,Ever everything oil pass.,Lot anyone war pass.,Coach large professor first.,Run food resource have article hot final.,Thus situation peace meet believe song up serious.,Part account someone participant simply tonight PM.,,,,,,,,,,,,,,,,,,,,,,,,,,,,,,,,,,,,,,,,,,,,,,,,,,,,,,,,,,,,,,,,,,,,,,,,,,,,,,,,,,,,,,,,,,797.66,,,,,,,,,,,,,,,,,,,,,,,,,,,,
655154a8bd3566023058294c,lsalazar,2022,February,585.18,1198.26,4291.94,3285.79,,,4554.52,,4592.4,,4229.29,4959.86,,2691.1,Gun quickly seem pretty commercial writer.,Make market present bank.,General no head with might.,Send support age able participant wear lot along.,Data piece expert door whether dog Democrat owner.,We herself reason today.,Subject process natural.,Later yourself thank several because cover especially.,Exist model what father step money.,,,,,,,,,,,,,,,,,,,,,,,,,,,,,,,,,,,,,,,,,,,,,,,,,,,,,,,,,,,,,,,,,,,,,,,,,,,,,,,,,,,,1608.65,,,1850.53,,3312.82,,,,,,,,,,,,,,,,,,,,,,,,,,
655154a8bd3566023058294d,lsalazar,2022,January,4827.42,4791.02,,,,,1315.64,,,,,3993.15,,,Standard partner recognize.,Move use tax Mr stay part step.,Could during fly.,Administration upon even young.,Morning idea nation perhaps catch site.,,,,,,,,,,,,,,,,,,,,,,,,,,,,,,,,,,,,,,,,,,,,,,,,,,,,,,,,,,,,,,,,,,,,,,,,,,,,,,,,,,,,,,,,,,,2338.61,124.78,1705.19,,,,,,,,,,,,,,,,,,,,,,,,,,
655154a8bd3566023058294e,lsalazar,2022,July,2761.92,232.09,1976.18,4513.54,4212.96,1588.43,,,,347.09,,77.3,3822.8,,Science ahead could government.,Floor top upon third model alone.,Provide travel television scientist.,Social let former executive with whose ready.,Full peace financial even type debate.,Center despite expert cell.,Professional author leg process exist pressure.,Six throughout human mention smile prevent treatment couple.,Language institution lawyer.,Social certain of purpose speech treat.,Involve tree measure know dark return past.,,,,,,,,,,,,,,,,,,,,,,,,,,,,,,,,,,,,,,,,,,,,,,,,,,,,,,,,,,,,,,,,,,,,,,,,,,,,,,,,,,,3780.2,,1048.05,2314.07,1992.56,,,,,,,,,,,,,,,,,,,,,,,,,,
655154a8bd3566023058294f,lsalazar,2022,June,3494.06,410.12,,4077.11,,,2532.48,,,,,,249.11,,Crime now assume technology stop.,A church big wall into mind.,West prepare area ask.,Suggest interesting camera bed baby final cover box.,Southern recognize staff.,Well real officer your nor particular perhaps.,Majority man page resource six soldier.,Share art single ten.,Style natural strong wife role child catch as.,,,,,,,,,,,,,,,,,,,,,,,,,,,,,,,,,,,,,,,,,,,,,,,,,,,,,,,,,,,,,,,,,,,,,,,,,,,,,,,,,,,,1060.36,,551.75,,569.54,,,,,,,,,,,,,,,,,,,,,,,,,,,
655154a8bd35660230582950,lsalazar,2022,March,4578.5,288.27,,1028.03,2311.26,,,,,3866.56,,,,2400.27,Democratic down great because seek.,Everything activity reflect lose body their know read.,Interest central organization shake gun.,Change involve total six ago road control.,,,,,,,,,,,,,,,,,,,,,,,,,,,,,,,,,,,,,,,,,,,,,,,,,,,,,,,,,,,,,,,,,,,,,,,,,,,,,,,,,,,,,,,,,2045,,3007.61,,,,,,,,,,,,,,,,,,,,,,,,,,,,,
655154a8bd35660230582951,lsalazar,2022,May,4246.78,,,,,3914.07,4479.95,,3127.8,,600.67,,,,Build instead edge seem image push must chair.,Contain personal civil word.,Instead reflect management back environmental task war no.,Phone Mrs understand close debate more turn.,May leg break join shake accept.,Crime young responsibility hour.,,,,,,,,,,,,,,,,,,,,,,,,,,,,,,,,,,,,,,,,,,,,,,,,,,,,,,,,,,,,,,,,,,,,,,,,,,,,,,,,,,,,,,,3404.8,1661.44,,,,,,,,,,,,,,,,,,,,,,,,,,,,,,
655154a8bd35660230582952,lsalazar,2022,November,343.43,2977.25,652.67,,4843.08,4755.67,2335.72,,,,,,,,Material remain plan allow themselves above order race.,Physical size interesting speech seat notice some.,Toward go whole machine while much.,,,,,,,,,,,,,,,,,,,,,,,,,,,,,,,,,,,,,,,,,,,,,,,,,,,,,,,,,,,,,,,,,,,,,,,,,,,,,,,,,,,,,,,,,,,1152.16,,,,,,,,,,,,,,,,,,,,,,,,,,,,,,
655154a8bd35660230582953,lsalazar,2022,October,2680.17,,,150.09,1234.79,,,4047.37,,,,3054.6,,,Cup bill expect check figure common market.,Sound another story someone hair maybe serve.,Huge political new store issue picture.,Couple analysis talk attack and teach I.,,,,,,,,,,,,,,,,,,,,,,,,,,,,,,,,,,,,,,,,,,,,,,,,,,,,,,,,,,,,,,,,,,,,,,,,,,,,,,,,,,,,,,,,,,,691.91,,2686.81,,,,,,,,,,,,,,,,,,,,,,,,,,,
655154a8bd35660230582954,lsalazar,2022,September,3643.79,,,927.52,,,,,3549.52,,4797.44,3864.71,4105.28,2806.56,Want person realize listen test.,Dinner wrong base stop along feeling board.,Might everything down couple.,Ball five whether.,Education thought produce often meeting suffer.,With tonight media court.,,,,,,,,,,,,,,,,,,,,,,,,,,,,,,,,,,,,,,,,,,,,,,,,,,,,,,,,,,,,,,,,,,,,,,,,,,,,,,,,,,,,,,,,4573.01,,,,4681.93,,,,,,,,,,,,,,,,,,,,,,,,,,
655154a8bd35660230582955,lsalazar,2023,February,,,422.02,3328.26,1419.75,1986.16,347.54,3826.55,,,3831.59,,744.89,,Entire reach even do different blood world.,Say common most ok.,Blue later result next south room eat little.,Could itself throw sense.,Must expect senior last under nice.,Medical wide these very.,Training society own show.,,,,,,,,,,,,,,,,,,,,,,,,,,,,,,,,,,,,,,,,,,,,,,,,,,,,,,,,,,,,,,,,,,,,,,,,,,,,,,,,,,,,,,3293.32,,,2375.28,,,,,,,,,,,,,,,,,,,,,,,,,,,,
655154a8bd35660230582956,lsalazar,2023,January,2083.02,4229.3,3303.46,,1069.7,4733.66,,,1155.29,4756.71,815.79,,,,Theory consumer him similar plan.,Might present herself up.,Ready consumer on.,Material require keep book.,Box develop well man than.,,,,,,,,,,,,,,,,,,,,,,,,,,,,,,,,,,,,,,,,,,,,,,,,,,,,,,,,,,,,,,,,,,,,,,,,,,,,,,,,,,,,,,,,4063.7,,,,2949.67,,,,,,,,,,,,,,,,,,,,,,,,,,,
655154a8bd35660230582957,lsalazar,2023,March,,1709.56,2924.59,2110.66,1269.27,,,,1776.68,2206.41,,2627.27,,,Same without grow gas president difference.,His traditional candidate population gas.,Positive entire various than firm however protect.,,,,,,,,,,,,,,,,,,,,,,,,,,,,,,,,,,,,,,,,,,,,,,,,,,,,,,,,,,,,,,,,,,,,,,,,,,,,,,,,,,,,,,,,,,4140.69,,,,,,,,,,,,,,,,,,,,,,,,,,,,,,,
655154a8bd35660230582958,mirandathomas,2015,April,,3888.94,636.06,3671.71,,,,133.17,,2593,2836.8,,,3448.41,Safe message each effect.,Environment job on spend each we wall buy.,Four government say rest also certainly.,Onto exist economic goal.,Owner take travel subject middle public church.,Adult simply truth know organization may perhaps.,,,,,,,,,,,,,,,,,,,,,,,,,,,,,,,,,,,,,,,,,,,,,,,,,,,,,,,,,,,,,,,,,,,,,,,,,,,,,,,,,,,,,,,2750.51,,3153.76,,1768.11,3624.89,,,,,,,,,,,,,,,,,,,,,,,,,,
655154a8bd35660230582959,mirandathomas,2015,August,2976.33,4614.8,3819.59,4879.46,,,4559.61,2293.81,3286.72,4342.04,4221.96,,,,Fish house any capital black.,Size community create rate high bring happy.,Future real student.,Science language day perform.,Care sense control lay condition force.,Maybe five candidate industry.,Major billion cup.,,,,,,,,,,,,,,,,,,,,,,,,,,,,,,,,,,,,,,,,,,,,,,,,,,,,,,,,,,,,,,,,,,,,,,,,,,,,,,,,,,,,,,,1772.8,2160.3,,,,,,,,,,,,,,,,,,,,,,,,,,,,,
655154a8bd3566023058295a,mirandathomas,2015,December,,,1084.49,4240.77,,,,4576.6,,819.58,,,1348.95,,Address customer knowledge couple college game.,Test fact significant rise.,Mention ever want whose before.,Receive billion position card bring.,Nation capital enough provide.,One owner toward her during produce.,Year quickly across should necessary his new.,Hot nor evening study strategy agent.,,,,,,,,,,,,,,,,,,,,,,,,,,,,,,,,,,,,,,,,,,,,,,,,,,,,,,,,,,,,,,,,,,,,,,,,,,,,,,,,,,,,,,,,,,633.52,,,,,,,,,,,,,,,,,,,,,,,,,,
655154a8bd3566023058295b,mirandathomas,2015,February,4846.53,,4721.11,4858.02,,2925.32,1255.43,3627.11,,,,,,,Wait value particular.,From each know may business color suggest wrong.,Drop body authority contain laugh expert bit.,While kind line.,Public yourself figure low claim prevent exist.,Mr catch nearly.,Meet owner lead future.,Read tell represent can surface nation.,,,,,,,,,,,,,,,,,,,,,,,,,,,,,,,,,,,,,,,,,,,,,,,,,,,,,,,,,,,,,,,,,,,,,,,,,,,,,,,,,,,,,,1485.53,2383.49,,1236.63,,,,,,,,,,,,,,,,,,,,,,,,,,,
655154a8bd3566023058295c,mirandathomas,2015,January,1835.5,,3217.59,,3631.5,292.92,3285.29,,,,,,,1113.46,Budget most produce speech.,Us car million thus.,Water perform body pull.,Spend grow still series let.,Staff hear usually.,,,,,,,,,,,,,,,,,,,,,,,,,,,,,,,,,,,,,,,,,,,,,,,,,,,,,,,,,,,,,,,,,,,,,,,,,,,,,,,,,,,,,,,,,906.08,1348.87,,2981.74,2504.05,,,,,,,,,,,,,,,,,,,,,,,,,,
655154a8bd3566023058295d,mirandathomas,2015,July,2700.49,,4055.61,2814.68,4866.15,1531.25,,,,4200.1,,4090.02,3685.32,4215.41,None these cell after fact attack.,Such head town create rate to.,Involve strong technology speech there into listen.,Soldier state pressure large compare although.,Economic poor see successful how start.,,,,,,,,,,,,,,,,,,,,,,,,,,,,,,,,,,,,,,,,,,,,,,,,,,,,,,,,,,,,,,,,,,,,,,,,,,,,,,,,,,,,,,,,271.29,,,,,4136.27,,,,,,,,,,,,,,,,,,,,,,,,,,
655154a8bd3566023058295e,mirandathomas,2015,June,4476.01,2565.23,303.06,2384.21,1828.58,,,249.3,3270.55,634.17,,,4330.14,,Three want institution strategy impact that.,Mrs ever share.,Word tree that case order.,Support new staff level.,Fine research chance.,War pressure bad many watch.,Scientist material eat.,,,,,,,,,,,,,,,,,,,,,,,,,,,,,,,,,,,,,,,,,,,,,,,,,,,,,,,,,,,,,,,,,,,,,,,,,,,,,,,,,,,,,,,,1531.91,,,2813.1,,,,,,,,,,,,,,,,,,,,,,,,,,
655154a8bd3566023058295f,mirandathomas,2015,March,2548.32,1798.73,,4954.64,1204.3,4036.21,4453.03,2471.75,,,,,501.13,,Nature debate president yet administration go half.,Side carry west process bar structure.,Fish specific month hear.,Author seven audience without up.,Value left owner.,Most group natural team born strong reality.,Long maybe official fund condition Democrat someone.,High section business Congress real.,,,,,,,,,,,,,,,,,,,,,,,,,,,,,,,,,,,,,,,,,,,,,,,,,,,,,,,,,,,,,,,,,,,,,,,,,,,,,,,,,,,,,,,1716.78,,,,,,,,,,,,,,,,,,,,,,,,,,,,,
655154a8bd35660230582960,mirandathomas,2015,May,1227.63,2525.54,2801.93,,4238.05,2144.06,1882.83,,,,,,,,Every analysis left finish.,At cause worry yard.,Democratic lawyer indicate property require president.,Maybe tax serious cultural charge value easy.,Store scientist reduce article rest paper.,Popular most quality question reach.,Economic plant listen sea herself bank.,,,,,,,,,,,,,,,,,,,,,,,,,,,,,,,,,,,,,,,,,,,,,,,,,,,,,,,,,,,,,,,,,,,,,,,,,,,,,,,,,,,,,,,,,,,,,,,,,,,,,,,,,,,,,,,,,,,,,
655154a8bd35660230582961,mirandathomas,2015,November,3341.86,2009.59,1244.39,3622.75,4843.29,,4035.43,2633.5,,,,,,,Table statement its stock eat question senior indicate.,Market system room step fund care.,Tonight hospital new voice fight sometimes.,Discover decade property.,American else red phone difficult.,Daughter source movie.,Push admit first.,,,,,,,,,,,,,,,,,,,,,,,,,,,,,,,,,,,,,,,,,,,,,,,,,,,,,,,,,,,,,,,,,,,,,,,,,,,,,,,,,,,,,,,606.81,1628.68,,,1295.97,,,,,,,,,,,,,,,,,,,,,,,,,,
655154a8bd35660230582962,mirandathomas,2015,October,,4993.86,,3986.26,,526.37,,,,3860.91,,3081.69,,,Wife sea me practice policy he.,Adult Democrat word somebody suffer.,Back message born campaign marriage around.,Including vote family doctor.,Police approach safe decade.,Would history remain then Mrs history.,Far right ready alone positive white.,,,,,,,,,,,,,,,,,,,,,,,,,,,,,,,,,,,,,,,,,,,,,,,,,,,,,,,,,,,,,,,,,,,,,,,,,,,,,,,,,,,,,,77.76,2041.38,,,,,,,,,,,,,,,,,,,,,,,,,,,,,,
655154a8bd35660230582963,mirandathomas,2015,September,,3282.18,,2944.58,916.33,1867.14,,397.89,88.99,,,3079.44,,,Care sit article decision.,Walk compare trade fine occur.,,,,,,,,,,,,,,,,,,,,,,,,,,,,,,,,,,,,,,,,,,,,,,,,,,,,,,,,,,,,,,,,,,,,,,,,,,,,,,,,,,,,,,,,,,,,,,,,3330.01,,,,,,,,,,,,,,,,,,,,,,,,,,
655154a8bd35660230582964,mirandathomas,2016,April,,3380.2,498.42,203.22,1679.8,,3332.7,,,4648.41,386.07,1369.76,,,Think indeed small throughout office threat.,Continue world station.,Beat TV own tonight recent say us.,Station field bit short.,Investment expert nor card manager.,Ever describe ball there cost.,True will positive order talk itself behind.,Education he to hour investment girl.,Administration perhaps street that.,Left your drug us everybody tend watch.,Hotel wonder become and.,,,,,,,,,,,,,,,,,,,,,,,,,,,,,,,,,,,,,,,,,,,,,,,,,,,,,,,,,,,,,,,,,,,,,,,,,,,,,,,,,,4782.62,2048.2,,,,,,,,,,,,,,,,,,,,,,,,,,,,,,
655154a8bd35660230582965,mirandathomas,2016,August,,2524,736.67,3648.81,1935.03,,,,4579.15,,344.28,4266.35,,1504.64,Go field away fill voice trip.,Stay certainly price financial.,Including to determine hit budget way eye.,There require protect commercial sister compare woman.,Politics pay three edge follow American significant.,,,,,,,,,,,,,,,,,,,,,,,,,,,,,,,,,,,,,,,,,,,,,,,,,,,,,,,,,,,,,,,,,,,,,,,,,,,,,,,,,,,,,,,,739.65,,,,,,,,,,,,,,,,,,,,,,,,,,,,,,,
655154a8bd35660230582966,mirandathomas,2016,December,118.82,3989.15,1662.14,,,4144.38,,,1821.62,4444.07,,,,3379.7,International church thing physical.,Already book whatever send.,Worker situation interview accept experience.,White know end environment his point.,Someone option must seven show kitchen include.,Near strategy theory firm tree.,Chance property agency.,Morning high into ready month also.,,,,,,,,,,,,,,,,,,,,,,,,,,,,,,,,,,,,,,,,,,,,,,,,,,,,,,,,,,,,,,,,,,,,,,,,,,,,,,,,,,,,,3403.11,,3226.27,4842.26,4057.9,,,,,,,,,,,,,,,,,,,,,,,,,,,
655154a8bd35660230582967,mirandathomas,2016,February,1450.88,,,,3481.03,4928.96,,261.02,1101.11,,,3700.35,,,Him size by less standard force trouble.,Cut investment be operation.,Me window mouth among number alone.,Admit level husband station study sense cover.,Successful since control.,Page once do pick nearly ready fish.,,,,,,,,,,,,,,,,,,,,,,,,,,,,,,,,,,,,,,,,,,,,,,,,,,,,,,,,,,,,,,,,,,,,,,,,,,,,,,,,,,,,,,,1225.26,,,,,3871.5,,,,,,,,,,,,,,,,,,,,,,,,,,
655154a8bd35660230582968,mirandathomas,2016,January,682.38,,3296.63,,4260.31,992.16,,,,,4525.42,,,,Although quite gun available.,Cultural approach couple total total strategy nor design.,Tv accept author scene capital news.,Edge both all religious woman wall recently two.,,,,,,,,,,,,,,,,,,,,,,,,,,,,,,,,,,,,,,,,,,,,,,,,,,,,,,,,,,,,,,,,,,,,,,,,,,,,,,,,,,,,,,,,,2581.35,,,,,,,,,,,,,,,,,,,,,,,,,,,,,,,
655154a8bd35660230582969,mirandathomas,2016,July,3719.34,3304.92,893.28,4201.2,4727.88,,,,1478.65,4634.54,4484.43,,,2766.65,Defense book production couple.,Three floor join color situation employee laugh.,,,,,,,,,,,,,,,,,,,,,,,,,,,,,,,,,,,,,,,,,,,,,,,,,,,,,,,,,,,,,,,,,,,,,,,,,,,,,,,,,,,,,,,,,,,,,,,952.91,,,,,,,,,,,,,,,,,,,,,,,,,,,
655154a8bd3566023058296a,mirandathomas,2016,June,186.24,2412.87,,2858.88,,14.65,1293.84,,,2729.03,3770.86,,2688.21,,Unit help history already to rule.,All personal management return although parent.,Attention finish process increase industry short.,Produce receive near happy.,,,,,,,,,,,,,,,,,,,,,,,,,,,,,,,,,,,,,,,,,,,,,,,,,,,,,,,,,,,,,,,,,,,,,,,,,,,,,,,,,,,,,,,,,1159.68,,,,,,,,,,,,,,,,,,,,,,,,,,,,,,,
655154a8bd3566023058296b,mirandathomas,2016,March,2494.29,2095.1,4530.29,2478.18,3977.53,35.18,,,4017.43,,,,1447.68,,Note study very letter.,Image activity mouth important buy.,Everyone second sense take in blood free.,Skin hundred sometimes enter space energy real.,Second cut somebody finally.,Street stop every me mind believe.,Mrs town and often finish help food.,Fear food official chance.,Someone early use.,Support because positive moment rise believe.,Address author actually yes risk mother.,Though go into story summer wall.,,,,,,,,,,,,,,,,,,,,,,,,,,,,,,,,,,,,,,,,,,,,,,,,,,,,,,,,,,,,,,,,,,,,,,,,,,,,,,,,,1297.5,813.8,,3362,3535.86,1500.53,,,,,,,,,,,,,,,,,,,,,,,,,,
655154a8bd3566023058296c,mirandathomas,2016,May,,,,,1388.36,4881.55,,4494.85,,3592.61,3513.35,,,,Miss gun program meeting then involve.,Suggest lead especially movement among today.,Site them better.,Large second drive focus tree against.,,,,,,,,,,,,,,,,,,,,,,,,,,,,,,,,,,,,,,,,,,,,,,,,,,,,,,,,,,,,,,,,,,,,,,,,,,,,,,,,,,,,,,,,,,2342.63,2403.11,,1494.86,2653.81,,,,,,,,,,,,,,,,,,,,,,,,,,
655154a8bd3566023058296d,mirandathomas,2016,November,,,,1629.5,3316.04,,1034.75,,,,,145.2,4790.11,,Position only clearly almost.,Weight stay on very have probably.,Lose common if worker budget five.,Task response dog common several like.,Contain upon firm reflect.,Big part concern loss trip former.,,,,,,,,,,,,,,,,,,,,,,,,,,,,,,,,,,,,,,,,,,,,,,,,,,,,,,,,,,,,,,,,,,,,,,,,,,,,,,,,,,,,,,,2648.69,,,,4357.17,2245.63,,,,,,,,,,,,,,,,,,,,,,,,,,
